author,body,created_utc,date_uploaded,distinguished,edited,id,is_submitter,link_id,parent_id,permalink,score,stickied,subreddit,subreddit_id
DGSTEE,"Wheeewwww just sold TRST yesterday. 

Reminds me of MARI and ATT. Sold right before the halt on all 3 of these pieces of shit. 

Sorry to everyone who didn’t sell.",1562852056.0,2019-07-11 18:04:36.545154,,False,etijljq,False,t3_cbti6r,t3_cbti6r,/r/weedstocks/comments/cbti6r/rweedstocks_casual_daily_discussion_july_11_2019/etijljq/,2,False,weedstocks,t5_2zfqj
Jaynki,Any folks in VIVO here? Lotta insider buying recently. Just grabbed 5K at 0.53c,1562852390.0,2019-07-11 18:04:36.545170,,False,etijz3i,False,t3_cbti6r,t3_cbti6r,/r/weedstocks/comments/cbti6r/rweedstocks_casual_daily_discussion_july_11_2019/etijz3i/,2,False,weedstocks,t5_2zfqj
NicPK,WEED..Do or Die !,1562853132.0,2019-07-11 18:04:36.545175,,False,etikthf,False,t3_cbti6r,t3_cbti6r,/r/weedstocks/comments/cbti6r/rweedstocks_casual_daily_discussion_july_11_2019/etikthf/,2,False,weedstocks,t5_2zfqj
WRONG_PREDICTION,"This sector is a joke

Will check back here in a few days, this is just too frustrating and tiring",1562853357.0,2019-07-11 18:04:36.545180,,False,etil2ni,False,t3_cbti6r,t3_cbti6r,/r/weedstocks/comments/cbti6r/rweedstocks_casual_daily_discussion_july_11_2019/etil2ni/,3,False,weedstocks,t5_2zfqj
klimeka001,Fuck it. I broke rule 1. Sold my WEED at a loss. And I'm playing this oversold bounce on vff. Down hard on no News?,1562853676.0,2019-07-11 18:04:36.545185,,False,etilfss,False,t3_cbti6r,t3_cbti6r,/r/weedstocks/comments/cbti6r/rweedstocks_casual_daily_discussion_july_11_2019/etilfss/,2,False,weedstocks,t5_2zfqj
Hoof_Hearted12,Anyone adding to OGI and HEXO at these prices?,1562854115.0,2019-07-11 18:04:36.545191,,False,etily2e,False,t3_cbti6r,t3_cbti6r,/r/weedstocks/comments/cbti6r/rweedstocks_casual_daily_discussion_july_11_2019/etily2e/,2,False,weedstocks,t5_2zfqj
dubsdube420,There’s the oversold bounce on TILT. Too bad it won’t hold.,1562855719.0,2019-07-11 18:04:36.545196,,False,etinwmz,False,t3_cbti6r,t3_cbti6r,/r/weedstocks/comments/cbti6r/rweedstocks_casual_daily_discussion_july_11_2019/etinwmz/,2,False,weedstocks,t5_2zfqj
akstock,So we found the bottom?,1562855979.0,2019-07-11 18:04:36.545200,,False,etio8i7,False,t3_cbti6r,t3_cbti6r,/r/weedstocks/comments/cbti6r/rweedstocks_casual_daily_discussion_july_11_2019/etio8i7/,2,False,weedstocks,t5_2zfqj
relikzz,FIRE is slowly being put out.. need to add some fuel,1562856047.0,2019-07-11 18:04:36.545205,,False,etiobme,False,t3_cbti6r,t3_cbti6r,/r/weedstocks/comments/cbti6r/rweedstocks_casual_daily_discussion_july_11_2019/etiobme/,2,False,weedstocks,t5_2zfqj
LuxGang,"I'm getting crushed on VFF and OH, jeez. I guess the market thinks OH CL deal isn't going through. VFF on the other hand I don't understand. They seem solid and undervalued, what an I missing?",1562856187.0,2019-07-11 18:04:36.545210,,False,etioie6,False,t3_cbti6r,t3_cbti6r,/r/weedstocks/comments/cbti6r/rweedstocks_casual_daily_discussion_july_11_2019/etioie6/,2,False,weedstocks,t5_2zfqj
Chouinard1984,"Sector is clearly only moving on news at the moment.

You pretty much just have to pray your company buts out some PR, otherwise it's headed down.

Sucks",1562857962.0,2019-07-11 18:04:36.545215,,False,etir5wb,False,t3_cbti6r,t3_cbti6r,/r/weedstocks/comments/cbti6r/rweedstocks_casual_daily_discussion_july_11_2019/etir5wb/,2,False,weedstocks,t5_2zfqj
whatthefkisthisbruh,Is chart man bag holding anything ?,1562859325.0,2019-07-11 18:04:36.545221,,False,etit9p9,False,t3_cbti6r,t3_cbti6r,/r/weedstocks/comments/cbti6r/rweedstocks_casual_daily_discussion_july_11_2019/etit9p9/,2,False,weedstocks,t5_2zfqj
cheeseburgz,"So the question we need to ask ourselves is: are we daytraders/swing traders or are we investors? 

If we're investors, why are we worried about the day-to-day, week-to-week, or even month-to-month? At a minimum, we should be looking at the 4 to 5 year time frame. Most good stocks have an ROI of  4% to 7 % year-over-year, right? By leaps and bounds anyone who has been investing for the past few years is probably up a ton by that standard. We're ahead of the game. I'm about 2 years in from my earliest weedstock investment, and with the exception of one stock (APHA) I'm well exceeding that metric.

If you're a trader, well then good luck to you, hope you time the bottom.",1562859891.0,2019-07-11 18:04:36.545226,,False,etiu5ti,False,t3_cbti6r,t3_cbti6r,/r/weedstocks/comments/cbti6r/rweedstocks_casual_daily_discussion_july_11_2019/etiu5ti/,2,False,weedstocks,t5_2zfqj
FUWS,"Damn,VFF taking a pounding...",1562859942.0,2019-07-11 18:04:36.545231,,False,etiu8ph,False,t3_cbti6r,t3_cbti6r,/r/weedstocks/comments/cbti6r/rweedstocks_casual_daily_discussion_july_11_2019/etiu8ph/,2,False,weedstocks,t5_2zfqj
zwybruck,Looks likes Cresco's retail brand will be called Sunnyside. Not bad imo.,1562860067.0,2019-07-11 18:04:36.545235,,False,etiuftn,False,t3_cbti6r,t3_cbti6r,/r/weedstocks/comments/cbti6r/rweedstocks_casual_daily_discussion_july_11_2019/etiuftn/,2,False,weedstocks,t5_2zfqj
thatguybuddy,I’m in line for the grand opening of our city’s first weed store. B.C. Better late then never. 40 people in the line on a workday at 9 am is interesting.,1562860349.0,2019-07-11 18:04:36.545239,,False,etiuwcv,False,t3_cbti6r,t3_cbti6r,/r/weedstocks/comments/cbti6r/rweedstocks_casual_daily_discussion_july_11_2019/etiuwcv/,2,False,weedstocks,t5_2zfqj
Marwangg,"How is this not being talked about more? Death spiral financing right here....

Gotham changed the terms to MMEN to allow them to have full access to the $250,000,000 regardless of price threshold but slashed conversion in tranche 1 from 3.25 to 2.55. And also slashed tranche 2 and 3 from USD$7 to USD$2.55 ( [https://imgur.com/a/ZhXIvfA](https://imgur.com/a/ZhXIvfA) )",1562860881.0,2019-07-11 18:04:36.545243,,False,etivrkf,False,t3_cbti6r,t3_cbti6r,/r/weedstocks/comments/cbti6r/rweedstocks_casual_daily_discussion_july_11_2019/etivrkf/,1,False,weedstocks,t5_2zfqj
thebox416,"""Stenocare, which caters to medical cannabis patients, added that ""most, yet not all"" of the CannTrust products in its inventory and that it has supplied to the Danish market since June 10 are linked to the unlicensed cannabis cultivation.""

I bet many companies are reaching out to StenoCare to see off they are reconsidering their supplier...",1562860908.0,2019-07-11 18:04:36.545247,,False,etivt51,False,t3_cbti6r,t3_cbti6r,/r/weedstocks/comments/cbti6r/rweedstocks_casual_daily_discussion_july_11_2019/etivt51/,1,False,weedstocks,t5_2zfqj
whatthefkisthisbruh,Trst rebounding,1562862317.0,2019-07-11 18:04:36.581362,,False,etiy2pu,False,t3_cbti6r,t3_cbti6r,/r/weedstocks/comments/cbti6r/rweedstocks_casual_daily_discussion_july_11_2019/etiy2pu/,1,False,weedstocks,t5_2zfqj
CMMish,Why is TRST recovering already?,1562862355.0,2019-07-11 18:04:36.581416,,False,etiy4yn,False,t3_cbti6r,t3_cbti6r,/r/weedstocks/comments/cbti6r/rweedstocks_casual_daily_discussion_july_11_2019/etiy4yn/,1,False,weedstocks,t5_2zfqj
p3p3d,Is this continuous downtrend just simply due to summer lull? Or is something driving the sector down? Seems like s&p and other indexes are doing well,1562862378.0,2019-07-11 18:04:36.581435,,False,etiy6b1,False,t3_cbti6r,t3_cbti6r,/r/weedstocks/comments/cbti6r/rweedstocks_casual_daily_discussion_july_11_2019/etiy6b1/,1,False,weedstocks,t5_2zfqj
Holdontoyourweed,"Just want to post this here https://www.reddit.com/r/weedstocks/comments/7pl83m/who_da_fook_is_getting_out/

Just so were clear ive have made over 100k and all cc debt has been paid off. This is with 20k initial capital and around 18k of credit card cash advance. Money can be made and you do have to take risks. obviously it payed off for me. Now to move towards the mill mark. Lets get this money boys.",1562863255.0,2019-07-11 18:04:36.581440,,False,etizmvu,False,t3_cbti6r,t3_cbti6r,/r/weedstocks/comments/cbti6r/rweedstocks_casual_daily_discussion_july_11_2019/etizmvu/,1,False,weedstocks,t5_2zfqj
Yonthetan,Would be nice to skip to October. Least there's something to look forward to then.,1562863327.0,2019-07-11 18:04:36.581445,,False,etizren,False,t3_cbti6r,t3_cbti6r,/r/weedstocks/comments/cbti6r/rweedstocks_casual_daily_discussion_july_11_2019/etizren/,1,False,weedstocks,t5_2zfqj
Th13teen_Gh0st,"Sigh, fuck

[Blood Filled Tears](https://youtu.be/Vsqz1Dtugew)",1562863327.0,2019-07-11 18:04:36.581450,,False,etizrgb,False,t3_cbti6r,t3_cbti6r,/r/weedstocks/comments/cbti6r/rweedstocks_casual_daily_discussion_july_11_2019/etizrgb/,1,False,weedstocks,t5_2zfqj
YaBoyMattyP,"So, would it be too risky to buy puts for Canntrust at 2.50 USD?",1562863507.0,2019-07-11 18:04:36.581455,,False,etj02wq,False,t3_cbti6r,t3_cbti6r,/r/weedstocks/comments/cbti6r/rweedstocks_casual_daily_discussion_july_11_2019/etj02wq/,1,False,weedstocks,t5_2zfqj
Mtanderson88,I’m pretty excited about the future of HMPQ now that they are nearing commercial production!!,1562863692.0,2019-07-11 18:04:36.581460,,False,etj0epa,False,t3_cbti6r,t3_cbti6r,/r/weedstocks/comments/cbti6r/rweedstocks_casual_daily_discussion_july_11_2019/etj0epa/,1,False,weedstocks,t5_2zfqj
Chouinard1984,"Damn.. I called CURA as a POS 3 weeks ago.. and yet I bought this week. I am complete moron, AMA",1562863762.0,2019-07-11 18:04:36.581465,,False,etj0ipz,False,t3_cbti6r,t3_cbti6r,/r/weedstocks/comments/cbti6r/rweedstocks_casual_daily_discussion_july_11_2019/etj0ipz/,1,False,weedstocks,t5_2zfqj
alderho10,Anyone have any interest in Dixie?  Just seems like a turd.  Deciding whether to average down or just sell for a small loss.,1562863915.0,2019-07-11 18:04:36.581470,,False,etj0r5x,False,t3_cbti6r,t3_cbti6r,/r/weedstocks/comments/cbti6r/rweedstocks_casual_daily_discussion_july_11_2019/etj0r5x/,1,False,weedstocks,t5_2zfqj
orakleboi,TRST UGHHHHHHHHHHHHHHHHHHHHHH,1562864313.0,2019-07-11 18:04:36.581475,,False,etj1ggd,False,t3_cbti6r,t3_cbti6r,/r/weedstocks/comments/cbti6r/rweedstocks_casual_daily_discussion_july_11_2019/etj1ggd/,1,False,weedstocks,t5_2zfqj
Alpha_Male76,Is the MJ bubble popping today? Canopy is dumping,1562866320.0,2019-07-11 18:04:36.581479,,False,etj507n,False,t3_cbti6r,t3_cbti6r,/r/weedstocks/comments/cbti6r/rweedstocks_casual_daily_discussion_july_11_2019/etj507n/,1,False,weedstocks,t5_2zfqj
goatmaster95,"any LHS holders? I feel like money I have in them could be put into other positions I already hold like HARV, IAN, APHA, OGI or CURA",1562866497.0,2019-07-11 18:04:36.581483,,False,etj5bhj,False,t3_cbti6r,t3_cbti6r,/r/weedstocks/comments/cbti6r/rweedstocks_casual_daily_discussion_july_11_2019/etj5bhj/,1,False,weedstocks,t5_2zfqj
lh7884,Does anyone here hold any weed stocks that are still in the green for them?,1562866703.0,2019-07-11 18:04:36.581488,,False,etj5ovl,False,t3_cbti6r,t3_cbti6r,/r/weedstocks/comments/cbti6r/rweedstocks_casual_daily_discussion_july_11_2019/etj5ovl/,1,False,weedstocks,t5_2zfqj
gozigzagman,Anybody waiting for WEED to hit $40 to start buying in?,1562867435.0,2019-07-11 18:04:36.581493,,False,etj70kd,False,t3_cbti6r,t3_cbti6r,/r/weedstocks/comments/cbti6r/rweedstocks_casual_daily_discussion_july_11_2019/etj70kd/,1,False,weedstocks,t5_2zfqj
JDeeezie,"Completely new to this,  23 yo with a decent job, but I want bank, what’s the first thing I do?",1562867636.0,2019-07-11 18:04:36.581498,,False,etj7dqq,False,t3_cbti6r,t3_cbti6r,/r/weedstocks/comments/cbti6r/rweedstocks_casual_daily_discussion_july_11_2019/etj7dqq/,1,False,weedstocks,t5_2zfqj
grandpapp,Epic CannTrust bounce incoming.,1562867711.0,2019-07-11 18:04:36.581502,,False,etj7iho,False,t3_cbti6r,t3_cbti6r,/r/weedstocks/comments/cbti6r/rweedstocks_casual_daily_discussion_july_11_2019/etj7iho/,1,False,weedstocks,t5_2zfqj
mfairview,There is no fire sale on CannTrust.  Just fire.  Grab your asbestos suits if you're still in this thing or considering entry.,1562837370.0,2019-07-11 18:04:36.581506,,False,eti3guk,False,t3_cbti6r,t3_cbti6r,/r/weedstocks/comments/cbti6r/rweedstocks_casual_daily_discussion_july_11_2019/eti3guk/,0,False,weedstocks,t5_2zfqj
,[removed],1562839211.0,2019-07-11 18:04:36.581520,,False,eti572b,False,t3_cbti6r,t3_cbti6r,/r/weedstocks/comments/cbti6r/rweedstocks_casual_daily_discussion_july_11_2019/eti572b/,1,False,weedstocks,t5_2zfqj
BestFill,"So I have some cash to invest, and besides putting a little more into HVT, I'm thinking of spreading across WEED and APHA, or just buying HMMJ.

Any one actually have cash that they are buying with today and not just pumpin? I see APHA under $9 and WEED around $50 and it seems like a safe hold if needed.",1562844230.0,2019-07-11 18:04:36.581580,,False,etiaigg,False,t3_cbti6r,t3_cbti6r,/r/weedstocks/comments/cbti6r/rweedstocks_casual_daily_discussion_july_11_2019/etiaigg/,1,False,weedstocks,t5_2zfqj
daccord_cava,What's up with this high ass bid on `GTII`,1562847226.0,2019-07-11 18:04:36.581586,,False,etidx33,False,t3_cbti6r,t3_cbti6r,/r/weedstocks/comments/cbti6r/rweedstocks_casual_daily_discussion_july_11_2019/etidx33/,1,False,weedstocks,t5_2zfqj
Th13teen_Gh0st,This is dispair man,1562849771.0,2019-07-11 18:04:36.581592,,False,etih22h,False,t3_cbti6r,t3_cbti6r,/r/weedstocks/comments/cbti6r/rweedstocks_casual_daily_discussion_july_11_2019/etih22h/,1,False,weedstocks,t5_2zfqj
wickity_wackk,Does anyone know why NU went up 40% yesterday? **,1562850034.0,2019-07-11 18:04:36.581597,,False,etihdtn,False,t3_cbti6r,t3_cbti6r,/r/weedstocks/comments/cbti6r/rweedstocks_casual_daily_discussion_july_11_2019/etihdtn/,1,False,weedstocks,t5_2zfqj
,[deleted],1562850214.0,2019-07-11 18:04:36.581602,,False,etihlqi,False,t3_cbti6r,t3_cbti6r,/r/weedstocks/comments/cbti6r/rweedstocks_casual_daily_discussion_july_11_2019/etihlqi/,1,False,weedstocks,t5_2zfqj
mariyachta,Damn didn't see the shit SNN took at the end of the day yesterday. Under 100 MC now. Jeez. Super tempting..,1562850952.0,2019-07-11 18:04:36.581623,,False,etiieoe,False,t3_cbti6r,t3_cbti6r,/r/weedstocks/comments/cbti6r/rweedstocks_casual_daily_discussion_july_11_2019/etiieoe/,1,False,weedstocks,t5_2zfqj
NotsonoobVFF,Goodluck today everyone,1562851472.0,2019-07-11 18:04:36.581629,,False,etiiywp,False,t3_cbti6r,t3_cbti6r,/r/weedstocks/comments/cbti6r/rweedstocks_casual_daily_discussion_july_11_2019/etiiywp/,1,False,weedstocks,t5_2zfqj
daccord_cava,"so what're the odds the next hindenburg short is `TRST`/`CTST`...

wasn't this their MO last time? they were already in a short and then pummeled `APHA` with their release...?",1562851534.0,2019-07-11 18:04:36.581634,,False,etij1c2,False,t3_cbti6r,t3_cbti6r,/r/weedstocks/comments/cbti6r/rweedstocks_casual_daily_discussion_july_11_2019/etij1c2/,1,False,weedstocks,t5_2zfqj
SkeeterBenJarvus,"Those Hindy Boi's must be making a KILLING. YRIV, APHA, and now this PRED company. Damn",1562852385.0,2019-07-11 18:04:36.581640,,False,etijyuy,False,t3_cbti6r,t3_cbti6r,/r/weedstocks/comments/cbti6r/rweedstocks_casual_daily_discussion_july_11_2019/etijyuy/,1,False,weedstocks,t5_2zfqj
anonymous_eddy,SPY green while the weed sector dwindles away. Shit will get interesting when SPY starts to consolidate.,1562852536.0,2019-07-11 18:04:36.581645,,False,etik50y,False,t3_cbti6r,t3_cbti6r,/r/weedstocks/comments/cbti6r/rweedstocks_casual_daily_discussion_july_11_2019/etik50y/,1,False,weedstocks,t5_2zfqj
Chouinard1984,"Wow...VFF dumping hard?

Did I miss something?",1562852589.0,2019-07-11 18:04:36.581651,,False,etik776,False,t3_cbti6r,t3_cbti6r,/r/weedstocks/comments/cbti6r/rweedstocks_casual_daily_discussion_july_11_2019/etik776/,1,False,weedstocks,t5_2zfqj
Yojimbo4133,We dead,1562852917.0,2019-07-11 18:04:36.581656,,False,etikkrk,False,t3_cbti6r,t3_cbti6r,/r/weedstocks/comments/cbti6r/rweedstocks_casual_daily_discussion_july_11_2019/etikkrk/,1,False,weedstocks,t5_2zfqj
j_poliquin,"Canntrust is time to buy ? Like APHA, OGI, Namaste and Mettrum crisis ?",1562854998.0,2019-07-11 18:04:36.581661,,False,etin0j5,False,t3_cbti6r,t3_cbti6r,/r/weedstocks/comments/cbti6r/rweedstocks_casual_daily_discussion_july_11_2019/etin0j5/,0,False,weedstocks,t5_2zfqj
aveloxx,If tilt can fill that $1.10 then that would be great,1562855353.0,2019-07-11 18:04:36.581666,,False,etinge4,False,t3_cbti6r,t3_cbti6r,/r/weedstocks/comments/cbti6r/rweedstocks_casual_daily_discussion_july_11_2019/etinge4/,1,False,weedstocks,t5_2zfqj
IggyCity,"Just think, there were people who bought TRST at $5 two days ago.",1562855398.0,2019-07-11 18:04:36.581680,,False,etinic9,False,t3_cbti6r,t3_cbti6r,/r/weedstocks/comments/cbti6r/rweedstocks_casual_daily_discussion_july_11_2019/etinic9/,1,False,weedstocks,t5_2zfqj
mattsycakes,Cura? Bueller? Bueller?,1562856073.0,2019-07-11 18:04:36.581686,,False,etiocvd,False,t3_cbti6r,t3_cbti6r,/r/weedstocks/comments/cbti6r/rweedstocks_casual_daily_discussion_july_11_2019/etiocvd/,1,False,weedstocks,t5_2zfqj
BrotherOland,Ogi taking another shit,1562858488.0,2019-07-11 18:04:36.581693,,False,etirz3n,False,t3_cbti6r,t3_cbti6r,/r/weedstocks/comments/cbti6r/rweedstocks_casual_daily_discussion_july_11_2019/etirz3n/,1,False,weedstocks,t5_2zfqj
moms_be_trippin,"Can anybody help with a question? I have 3 shares of [ASUA.CN](https://ASUA.CN) and [AUSA.WT.CN](https://AUSA.WT.CN). They've been sitting in my account for a while (worth about $2-3 each), but Questrade isn't letting me sell them. Any idea when I will be able to sell?",1562862647.0,2019-07-11 18:04:36.581700,,False,etiylxp,False,t3_cbti6r,t3_cbti6r,/r/weedstocks/comments/cbti6r/rweedstocks_casual_daily_discussion_july_11_2019/etiylxp/,1,False,weedstocks,t5_2zfqj
Engineeredweed,Why’d HVT get pumped and dumped?,1562865607.0,2019-07-11 18:04:36.581706,,False,etj3qik,False,t3_cbti6r,t3_cbti6r,/r/weedstocks/comments/cbti6r/rweedstocks_casual_daily_discussion_july_11_2019/etj3qik/,1,False,weedstocks,t5_2zfqj
AnonoEuph,So what ARE the green market movers? All my weedstocks AND the rest of my portfolio is red wtf,1562866078.0,2019-07-11 18:04:36.581710,,False,etj4kfv,False,t3_cbti6r,t3_cbti6r,/r/weedstocks/comments/cbti6r/rweedstocks_casual_daily_discussion_july_11_2019/etj4kfv/,1,False,weedstocks,t5_2zfqj
Gus_Griswald,OGI dump before earnings?,1562866159.0,2019-07-11 18:04:36.581716,,False,etj4pmd,False,t3_cbti6r,t3_cbti6r,/r/weedstocks/comments/cbti6r/rweedstocks_casual_daily_discussion_july_11_2019/etj4pmd/,1,False,weedstocks,t5_2zfqj
ryanl247,"Can someone help me out? What does this mean in sedi reports?

  Acquisition or disposition pursuant to a take-over bid, merger or acquisition 

with what looks like a purchase of shares?",1562866196.0,2019-07-11 18:04:36.581722,,False,etj4s2z,False,t3_cbti6r,t3_cbti6r,/r/weedstocks/comments/cbti6r/rweedstocks_casual_daily_discussion_july_11_2019/etj4s2z/,1,False,weedstocks,t5_2zfqj
Jaynki,HMMJ is about to break out of a descending wedge. Patience friends,1562866628.0,2019-07-11 18:04:36.581728,,False,etj5k27,False,t3_cbti6r,t3_cbti6r,/r/weedstocks/comments/cbti6r/rweedstocks_casual_daily_discussion_july_11_2019/etj5k27/,1,False,weedstocks,t5_2zfqj
rude-a-bega,What's the hives thoughts about OGI financials next week?,1562867069.0,2019-07-11 18:04:36.581734,,False,etj6crz,False,t3_cbti6r,t3_cbti6r,/r/weedstocks/comments/cbti6r/rweedstocks_casual_daily_discussion_july_11_2019/etj6crz/,1,False,weedstocks,t5_2zfqj
dividedthoughts,"Why is FLWR so strong? It really hasn't pulled back like many others in the sector.  It recovered quickly after they announced the last raise, with no details either.",1562867272.0,2019-07-11 18:04:36.581740,,False,etj6pum,False,t3_cbti6r,t3_cbti6r,/r/weedstocks/comments/cbti6r/rweedstocks_casual_daily_discussion_july_11_2019/etj6pum/,1,False,weedstocks,t5_2zfqj
detarrednu,That VGW bull parade got tripped up. Is this the lower high before impressive financials?,1562867524.0,2019-07-11 18:04:36.581745,,False,etj76i8,False,t3_cbti6r,t3_cbti6r,/r/weedstocks/comments/cbti6r/rweedstocks_casual_daily_discussion_july_11_2019/etj76i8/,1,False,weedstocks,t5_2zfqj
olivertwist225,Vff continues to take a beating.,1562861694.0,2019-07-11 18:04:36.581750,,False,etix2c1,False,t3_cbti6r,t3_cbti6r,/r/weedstocks/comments/cbti6r/rweedstocks_casual_daily_discussion_july_11_2019/etix2c1/,1,False,weedstocks,t5_2zfqj
Canopian,"Who will pick up TRSTs market share? ACB, APHA? Is Apha producing enough pot now? Someone is going to benefit from this",1562855948.0,2019-07-11 18:04:36.581755,,False,etio72q,False,t3_cbti6r,t3_cbti6r,/r/weedstocks/comments/cbti6r/rweedstocks_casual_daily_discussion_july_11_2019/etio72q/,1,False,weedstocks,t5_2zfqj
WRONG_PREDICTION,Ogi financials are going to horrendous based on how much it has fallen in the last few days!,1562856088.0,2019-07-11 18:04:36.581762,,False,etiodlb,False,t3_cbti6r,t3_cbti6r,/r/weedstocks/comments/cbti6r/rweedstocks_casual_daily_discussion_july_11_2019/etiodlb/,1,False,weedstocks,t5_2zfqj
raisecain,What's the best forum to ask a question regarding strains of weed? I have a recipe that asks for sour diesel and that's not available in Quebec (unless I'm mistaken) and I'm hoping someone can help me find a comparable option. Thanks. Also—stupid question: Can i buy weed legally from canadian online dispensaries that are not official government websites? I've only ever bought weed IRL.,1562858735.0,2019-07-11 18:04:36.581767,,False,etisct4,False,t3_cbti6r,t3_cbti6r,/r/weedstocks/comments/cbti6r/rweedstocks_casual_daily_discussion_july_11_2019/etisct4/,1,False,weedstocks,t5_2zfqj
NiamorJafar,Fuck you STZ.  Can't even exercise your 2nd tranche of warrants at this price you fucking idiots.,1562866619.0,2019-07-11 18:04:36.581773,,False,etj5jdp,False,t3_cbti6r,t3_cbti6r,/r/weedstocks/comments/cbti6r/rweedstocks_casual_daily_discussion_july_11_2019/etj5jdp/,1,False,weedstocks,t5_2zfqj
slie911,"Anyone else notice that a hit piece on MMEN is released by shorts after positive news releases? Always the same bullshit about ""widening operating losses"".

It's like these articles are pre-written and released after every positive news release from the company. 

What a fuckin joke already smh",1562846003.0,2019-07-11 18:04:36.581779,,False,eticjmh,False,t3_cbti6r,t3_cbti6r,/r/weedstocks/comments/cbti6r/rweedstocks_casual_daily_discussion_july_11_2019/eticjmh/,-1,False,weedstocks,t5_2zfqj
gmtloot,Thoughts on $HUGE? (FSD Pharma),1562850113.0,2019-07-11 18:04:36.581784,,False,etihh9v,False,t3_cbti6r,t3_cbti6r,/r/weedstocks/comments/cbti6r/rweedstocks_casual_daily_discussion_july_11_2019/etihh9v/,0,False,weedstocks,t5_2zfqj
sonduu,Trust the Process...lawl,1562853331.0,2019-07-11 18:04:36.581791,,False,etil1ky,False,t3_cbti6r,t3_cbti6r,/r/weedstocks/comments/cbti6r/rweedstocks_casual_daily_discussion_july_11_2019/etil1ky/,0,False,weedstocks,t5_2zfqj
Auhmaze,"Peter: Bitcoin.


Lois: what?


Peter: I don’t know",1562859551.0,2019-07-11 18:04:36.581796,,False,etitmh8,False,t3_cbti6r,t3_cbti6r,/r/weedstocks/comments/cbti6r/rweedstocks_casual_daily_discussion_july_11_2019/etitmh8/,0,False,weedstocks,t5_2zfqj
IamtryigOKAY,"Trst going down, boys hold the bags",1562842240.0,2019-07-11 18:04:36.581800,,False,eti8goj,False,t3_cbti6r,t3_cbti6r,/r/weedstocks/comments/cbti6r/rweedstocks_casual_daily_discussion_july_11_2019/eti8goj/,0,False,weedstocks,t5_2zfqj
TheClayroo,"Hey Mods I keep missing flair request threads. Could I request my first flair?

""Hello IAN? Yes, I would like a refund.""",1562846565.0,2019-07-11 18:04:36.581805,,False,etid694,False,t3_cbti6r,t3_cbti6r,/r/weedstocks/comments/cbti6r/rweedstocks_casual_daily_discussion_july_11_2019/etid694/,0,False,weedstocks,t5_2zfqj
shanski88,"Alright so looking for advice. 3 options as I see it. I put 12k in ctst at 10.02 holy fuck bad idea. Anyway now I'm down 70% and my 12k is worth 3500. Option 1. Do I buy 2500-3k more of ctst at 3 bucks and average down 2. Long hold. 3. Sell at 70% loss and play the 3500 somewhere else hoping to make a 350% return and get my 12k back ?

I'm leaning towards 2500 more at 3$ for an average down.",1562854635.0,2019-07-11 18:04:36.581810,,False,etimkk5,False,t3_cbti6r,t3_cbti6r,/r/weedstocks/comments/cbti6r/rweedstocks_casual_daily_discussion_july_11_2019/etimkk5/,0,False,weedstocks,t5_2zfqj
cookie_n,Canadian LP's are done imo. This TRST thing will be a catalyst that starts to get people to realize the Canadian market is too small and too ill conceived. Sales this year are going to be under 1 billion dollars. In no way does that even begin to justify MCs. MSO's are the way to go.,1562855892.0,2019-07-11 18:04:36.581821,,False,etio4i1,False,t3_cbti6r,t3_cbti6r,/r/weedstocks/comments/cbti6r/rweedstocks_casual_daily_discussion_july_11_2019/etio4i1/,-7,False,weedstocks,t5_2zfqj
STressed14,I had a dream HC halted every LP and their operations until a detailed review of each was complete.,1562843950.0,2019-07-11 18:04:36.581827,,False,etia920,False,t3_cbti6r,t3_cbti6r,/r/weedstocks/comments/cbti6r/rweedstocks_casual_daily_discussion_july_11_2019/etia920/,-1,False,weedstocks,t5_2zfqj
cram213,"If only there were a third option after puts and calls.  The option to make money as long as the stock stays in a certain range.  

APHRIA holders would be mooning!",1562845229.0,2019-07-11 18:04:36.581832,,False,etibmat,False,t3_cbti6r,t3_cbti6r,/r/weedstocks/comments/cbti6r/rweedstocks_casual_daily_discussion_july_11_2019/etibmat/,0,False,weedstocks,t5_2zfqj
QueafyGreens,Just bailed on Med Men. All that and I made 10 bucks....,1562861247.0,2019-07-11 18:04:36.581837,,False,etiwcke,False,t3_cbti6r,t3_cbti6r,/r/weedstocks/comments/cbti6r/rweedstocks_casual_daily_discussion_july_11_2019/etiwcke/,1,False,weedstocks,t5_2zfqj
skyplt29,"A friend of mine got caught...

Never mind.  So much hate here.",1562847366.0,2019-07-11 18:04:36.581843,,1562848923.0,etie30d,False,t3_cbti6r,t3_cbti6r,/r/weedstocks/comments/cbti6r/rweedstocks_casual_daily_discussion_july_11_2019/etie30d/,-7,False,weedstocks,t5_2zfqj
