author,body,created_utc,date_uploaded,distinguished,edited,id,is_submitter,link_id,parent_id,permalink,score,stickied,subreddit,subreddit_id
jamanatron,Not necessarily. These plants are spaced farther apart to allow lots of growth and the genetics are specifically picked for their ability to thrive in eastern Ontario. This is Derek Pedro’s stuff. Arguably the most knowledgeable outdoor grower there is in Canada.,1562852403.0,2019-07-11 18:04:36.621838,,False,etijzmp,False,t3_cbti6r,t1_etig7c5,/r/weedstocks/comments/cbti6r/rweedstocks_casual_daily_discussion_july_11_2019/etijzmp/,1,False,weedstocks,t5_2zfqj
rbryant67,Don't discourage it,1562859103.0,2019-07-11 18:04:36.621849,,False,etisxce,False,t3_cbti6r,t1_etisp7w,/r/weedstocks/comments/cbti6r/rweedstocks_casual_daily_discussion_july_11_2019/etisxce/,4,False,weedstocks,t5_2zfqj
jonmcduff,Had galiano this weekend. Wew lad.,1562862683.0,2019-07-11 18:04:36.621855,,False,etiynz6,False,t3_cbti6r,t1_etiy8f9,/r/weedstocks/comments/cbti6r/rweedstocks_casual_daily_discussion_july_11_2019/etiynz6/,1,False,weedstocks,t5_2zfqj
Leafs_420,">but at least I’m confident that eventually the tide will shift as it always does

famous last words?",1562861666.0,2019-07-11 18:04:36.621860,,False,etix0q5,False,t3_cbti6r,t1_etiwahu,/r/weedstocks/comments/cbti6r/rweedstocks_casual_daily_discussion_july_11_2019/etix0q5/,1,False,weedstocks,t5_2zfqj
mariyachta,The CEO said in an interview that he walks the facility almost daily. He would know.,1562866033.0,2019-07-11 18:04:36.621865,,False,etj4hh6,False,t3_cbti6r,t1_etj3yhk,/r/weedstocks/comments/cbti6r/rweedstocks_casual_daily_discussion_july_11_2019/etj4hh6/,1,False,weedstocks,t5_2zfqj
Leafs_420,"doesnt that set a dangerous precedent if all thats required is for the weed to be up to HC standards?  What if they found me growing in my garage, tested the weed and its up to par?  I dont think the issue is regarding the quality, its illegal bud no matter which way you look at it.  Even worse, its already been sold, approved by the government, and even distributed internationally.   Is it the end of the world for TRST?  not sure, but its definitely pretty serious",1562866026.0,2019-07-11 18:04:36.621871,,False,etj4gz8,False,t3_cbti6r,t1_etj2zsy,/r/weedstocks/comments/cbti6r/rweedstocks_casual_daily_discussion_july_11_2019/etj4gz8/,1,False,weedstocks,t5_2zfqj
darksider902,The stocks have a much better chance then the Raptors.,1562867271.0,2019-07-11 18:04:36.621879,,False,etj6pro,False,t3_cbti6r,t1_etj6md6,/r/weedstocks/comments/cbti6r/rweedstocks_casual_daily_discussion_july_11_2019/etj6pro/,1,False,weedstocks,t5_2zfqj
Thevanguard88,Soy boy millenials,1562845136.0,2019-07-11 18:04:36.621885,,1562845413.0,etibhtx,False,t3_cbti6r,t1_etia6wr,/r/weedstocks/comments/cbti6r/rweedstocks_casual_daily_discussion_july_11_2019/etibhtx/,-2,False,weedstocks,t5_2zfqj
IWanaTalk2Samson,#Wednesday.,1562846861.0,2019-07-11 18:04:36.621896,,False,etidino,False,t3_cbti6r,t1_etia58s,/r/weedstocks/comments/cbti6r/rweedstocks_casual_daily_discussion_july_11_2019/etidino/,2,False,weedstocks,t5_2zfqj
TheClayroo,The biggest difference being the TRST jokers aren't stuck with lame flairs...,1562846000.0,2019-07-11 18:04:36.621902,,False,eticji3,False,t3_cbti6r,t1_etibk40,/r/weedstocks/comments/cbti6r/rweedstocks_casual_daily_discussion_july_11_2019/eticji3/,5,False,weedstocks,t5_2zfqj
Hoof_Hearted12,"As someone heavily invested in both, this has been a rough year.",1562854637.0,2019-07-11 18:04:36.621907,,False,etimkmt,False,t3_cbti6r,t1_etima7q,/r/weedstocks/comments/cbti6r/rweedstocks_casual_daily_discussion_july_11_2019/etimkmt/,5,False,weedstocks,t5_2zfqj
liltooly,"Fundamental, yes but it could still go down further especially after ER :/",1562854682.0,2019-07-11 18:04:36.621913,,False,etimmm0,False,t3_cbti6r,t1_etim7ew,/r/weedstocks/comments/cbti6r/rweedstocks_casual_daily_discussion_july_11_2019/etimmm0/,3,False,weedstocks,t5_2zfqj
Raptorswon,"You don't get what you deserve in life, you get what have the leverage to negotiate for. The best management teams in this sector have also created the most shareholder wealth.

If APH had Mike G at the head of their operations, they'd be trading at multiples of their current valuation. And who exactly is trading at book value in this sector anyway?

An industry rampant with scandals and a litany examples of ineptitude, CRON stands out as a steward. CRON laid out their business case to Altria and they bought it. Kudos to management for having the ability to sell their vision and from the sounds of it, it isn't one centered around maximizing their growing space in the CDN market.

The CRON story will be an interesting story to follow for years.",1562858243.0,2019-07-11 18:04:36.621918,,1562858631.0,etirlit,False,t3_cbti6r,t1_etir1xd,/r/weedstocks/comments/cbti6r/rweedstocks_casual_daily_discussion_july_11_2019/etirlit/,4,False,weedstocks,t5_2zfqj
Shalom1420,"market disagrees, A management team is worth many billions. 

&#x200B;

Look at the difference between APHA and CRON.

&#x200B;

APHA more assets, self dealing management,  2 bill market Cap.

&#x200B;

CRON management team aren't crooks, 7 billion.

&#x200B;

Listen to MR market, hes never wrong.",1562861544.0,2019-07-11 18:04:36.621924,,False,etiwtny,False,t3_cbti6r,t1_etir1xd,/r/weedstocks/comments/cbti6r/rweedstocks_casual_daily_discussion_july_11_2019/etiwtny/,1,False,weedstocks,t5_2zfqj
Raptorswon,"All you have to do is listen to Mike talk once, it's not hard to grow enamored with him.",1562858665.0,2019-07-11 18:04:36.621942,,False,etis8st,False,t3_cbti6r,t1_etir28h,/r/weedstocks/comments/cbti6r/rweedstocks_casual_daily_discussion_july_11_2019/etis8st/,0,False,weedstocks,t5_2zfqj
dubsdube420,Should we tell him that we’re in July now?,1562864158.0,2019-07-11 18:04:36.621953,,False,etj16h7,False,t3_cbti6r,t1_etixvv8,/r/weedstocks/comments/cbti6r/rweedstocks_casual_daily_discussion_july_11_2019/etj16h7/,1,False,weedstocks,t5_2zfqj
w2211,buy trst,1562865016.0,2019-07-11 18:04:36.621959,,False,etj2oyj,False,t3_cbti6r,t1_etj2cv6,/r/weedstocks/comments/cbti6r/rweedstocks_casual_daily_discussion_july_11_2019/etj2oyj/,1,False,weedstocks,t5_2zfqj
ninethirtyone,"Yeah, it kind of would. Think about it for a second. Even if any of the other LP's were dumb enough to do what TRST did, they now know exactly what it will do to their company, their reputation, but most importantly, their stock. Do you have any idea how much stock insiders hold? It's completely against their own interests to fuck up their company, for potential short term company profit.. by breaking the law.

What TRST did was wildly stupid, and while there are some dumb players in this game, I really don't think anyone is going to look at this and go ""Yeah, that seems like a great idea, let's also build some fake walls.""",1562847476.0,2019-07-11 18:04:36.621964,,False,etie7op,False,t3_cbti6r,t1_etidlgc,/r/weedstocks/comments/cbti6r/rweedstocks_casual_daily_discussion_july_11_2019/etie7op/,4,False,weedstocks,t5_2zfqj
thedommer,This. Crazy times we live in.,1562851263.0,2019-07-11 18:04:36.621969,,False,etiiqqs,False,t3_cbti6r,t1_etih00t,/r/weedstocks/comments/cbti6r/rweedstocks_casual_daily_discussion_july_11_2019/etiiqqs/,1,False,weedstocks,t5_2zfqj
klawsveryown,"Fair enough but if HC doesn't lay down the hammer, then other MJ LPs will have an incentive not to follow the rules. 

If HC slaps you on the wrist every time, then why not just cheat the rules due to minimal consequences.",1562851307.0,2019-07-11 18:04:36.621975,,False,etiisfi,False,t3_cbti6r,t1_etih00t,/r/weedstocks/comments/cbti6r/rweedstocks_casual_daily_discussion_july_11_2019/etiisfi/,1,False,weedstocks,t5_2zfqj
rusharz,"If HC does something drastic with TRST, it will be seen as hypocritical and incentivize further black-market activity.",1562851275.0,2019-07-11 18:04:36.621980,,False,etiir66,False,t3_cbti6r,t1_etih00t,/r/weedstocks/comments/cbti6r/rweedstocks_casual_daily_discussion_july_11_2019/etiir66/,0,False,weedstocks,t5_2zfqj
Pooperoni_Pizza,[https://www.reddit.com/r/weedstocks/comments/cbopsb/_/](https://www.reddit.com/r/weedstocks/comments/cbopsb/_/),1562851154.0,2019-07-11 18:04:36.621986,,False,etiimgl,False,t3_cbti6r,t1_etii4tp,/r/weedstocks/comments/cbti6r/rweedstocks_casual_daily_discussion_july_11_2019/etiimgl/,1,False,weedstocks,t5_2zfqj
chongerton,dec 20,1562852962.0,2019-07-11 18:04:36.621996,,False,etikmmx,False,t3_cbti6r,t1_etiklf5,/r/weedstocks/comments/cbti6r/rweedstocks_casual_daily_discussion_july_11_2019/etikmmx/,1,False,weedstocks,t5_2zfqj
chongerton,looks like hes up about 8% right now...,1562852699.0,2019-07-11 18:04:36.622002,,False,etikbqf,False,t3_cbti6r,t1_etik725,/r/weedstocks/comments/cbti6r/rweedstocks_casual_daily_discussion_july_11_2019/etikbqf/,3,False,weedstocks,t5_2zfqj
5awtooth,Do I detect an undertone of skepticism? I’m up $3k so far. Getting very close to my sell price. How’s your day going?,1562862833.0,2019-07-11 18:04:36.622007,,False,etiywo3,False,t3_cbti6r,t1_etik725,/r/weedstocks/comments/cbti6r/rweedstocks_casual_daily_discussion_july_11_2019/etiywo3/,1,False,weedstocks,t5_2zfqj
klimeka001,username checks out.,1562858479.0,2019-07-11 18:04:36.622012,,False,etiryl5,False,t3_cbti6r,t1_etimgej,/r/weedstocks/comments/cbti6r/rweedstocks_casual_daily_discussion_july_11_2019/etiryl5/,1,False,weedstocks,t5_2zfqj
hoochtag,"I just meant that it’s a possibility and hence a risk that’s out there. Making fake walls to hide illegal grow rooms, (if reports are true) to deceive HC is something that HC could lower the boom on. I doubt they will lose it but it’s possible. If they lose it I think it would be a death blow.",1562857018.0,2019-07-11 18:04:36.622018,,False,etipq25,False,t3_cbti6r,t1_etioiqb,/r/weedstocks/comments/cbti6r/rweedstocks_casual_daily_discussion_july_11_2019/etipq25/,1,False,weedstocks,t5_2zfqj
A-10Fighter,Are you sticking with TRST or pulling out? I also just got burnt,1562860279.0,2019-07-11 18:04:36.622023,,False,etius3s,False,t3_cbti6r,t1_etiubjt,/r/weedstocks/comments/cbti6r/rweedstocks_casual_daily_discussion_july_11_2019/etius3s/,1,False,weedstocks,t5_2zfqj
discowalrus,"If they shipped any of that stuff overseas, they are done. If management willfully lied to HC, they are done. If they have to destroy all that dope, they are done. If they lose their license, they are done.

&#x200B;

Regulators exist for a purpose, and that is to prevent bad things from happening and dropping the hammer on violators when they do. And this is pretty fucking bad. 

&#x200B;

This company isn't a dumpster fire, it is a flaming garbage pile spreading toxic smoke all over the rest of the sector. Investing in them now is straight up gambling, and the house has all the cards.",1562861366.0,2019-07-11 18:04:36.622028,,False,etiwjfs,False,t3_cbti6r,t1_etivxgk,/r/weedstocks/comments/cbti6r/rweedstocks_casual_daily_discussion_july_11_2019/etiwjfs/,1,False,weedstocks,t5_2zfqj
255979119,Anyone lucky enough to tour Sky or A1 are in for a real treat.,1562863222.0,2019-07-11 18:04:36.622049,,False,etizku4,False,t3_cbti6r,t1_etizgu8,/r/weedstocks/comments/cbti6r/rweedstocks_casual_daily_discussion_july_11_2019/etizku4/,1,False,weedstocks,t5_2zfqj
gozigzagman,"Cool....do you just schedule a tour or is this a one time thing they are doing?

I have most of August off...trying to find things to do!",1562863430.0,2019-07-11 18:04:36.622054,,False,etizy04,False,t3_cbti6r,t1_etizgu8,/r/weedstocks/comments/cbti6r/rweedstocks_casual_daily_discussion_july_11_2019/etizy04/,1,False,weedstocks,t5_2zfqj
el-squatcho,take pics!,1562863673.0,2019-07-11 18:04:36.622059,,False,etj0dj5,False,t3_cbti6r,t1_etizgu8,/r/weedstocks/comments/cbti6r/rweedstocks_casual_daily_discussion_july_11_2019/etj0dj5/,1,False,weedstocks,t5_2zfqj
scarydrew,What new news?,1562864138.0,2019-07-11 18:04:36.622064,,False,etj1580,False,t3_cbti6r,t1_etj0xsl,/r/weedstocks/comments/cbti6r/rweedstocks_casual_daily_discussion_july_11_2019/etj1580/,1,False,weedstocks,t5_2zfqj
255979119,Daily RSI was around 10,1562864302.0,2019-07-11 18:04:36.622069,,False,etj1fqe,False,t3_cbti6r,t1_etj0xsl,/r/weedstocks/comments/cbti6r/rweedstocks_casual_daily_discussion_july_11_2019/etj1fqe/,1,False,weedstocks,t5_2zfqj
Pug_Ugly_Moe,Everyday you have it open you pay interest on the loaned shares. Being greedy while shorting can really screw you if you miss time it. It's,1562864351.0,2019-07-11 18:04:36.622074,,False,etj1ito,False,t3_cbti6r,t1_etj0xsl,/r/weedstocks/comments/cbti6r/rweedstocks_casual_daily_discussion_july_11_2019/etj1ito/,1,False,weedstocks,t5_2zfqj
Yonthetan,Fair enough. Hurts me regardless. Wish he just went through external financing instead to offload the shares so that it wouldn't have this kind of long lasting impact.,1562865031.0,2019-07-11 18:04:36.622078,,False,etj2q12,False,t3_cbti6r,t1_etj2bx1,/r/weedstocks/comments/cbti6r/rweedstocks_casual_daily_discussion_july_11_2019/etj2q12/,1,False,weedstocks,t5_2zfqj
STOOFONAROOF,Lots of good companies in the mix.. all way off their highs except trulieve which is still off its high.. GTII CURA HARV OH... MMen... this things going to blow up in the near future.,1562866283.0,2019-07-11 18:04:36.622089,,False,etj4xv9,False,t3_cbti6r,t1_etj3jiz,/r/weedstocks/comments/cbti6r/rweedstocks_casual_daily_discussion_july_11_2019/etj4xv9/,1,False,weedstocks,t5_2zfqj
FlyingCake,"First, please explain how I am being ""negative""?",1562867822.0,2019-07-11 18:04:36.622100,,False,etj7p7r,False,t3_cbti6r,t1_etj76a8,/r/weedstocks/comments/cbti6r/rweedstocks_casual_daily_discussion_july_11_2019/etj7p7r/,1,False,weedstocks,t5_2zfqj
FlyingCake,"Both... But realistically, if the sector goes up 200% on no volume.. Will people really call this a ""lull""? I don't think so.",1562867784.0,2019-07-11 18:04:36.622106,,False,etj7mzc,False,t3_cbti6r,t1_etj7867,/r/weedstocks/comments/cbti6r/rweedstocks_casual_daily_discussion_july_11_2019/etj7mzc/,1,False,weedstocks,t5_2zfqj
wrinkledpenny,Sorry I was just washing my hands again. What did I miss?,1562847779.0,2019-07-11 18:04:36.622111,,False,etiekjc,False,t3_cbti6r,t1_etidk5k,/r/weedstocks/comments/cbti6r/rweedstocks_casual_daily_discussion_july_11_2019/etiekjc/,2,False,weedstocks,t5_2zfqj
Blistorious,"Ah, thanks, not a native speaker and always thankful for corrections.",1562862652.0,2019-07-11 18:04:36.622116,,False,etiym7h,False,t3_cbti6r,t1_etiwzqc,/r/weedstocks/comments/cbti6r/rweedstocks_casual_daily_discussion_july_11_2019/etiym7h/,1,False,weedstocks,t5_2zfqj
streetvoyager,"If they don’t pull the license, when shit hits rock bottom it’s might be a great buy. It might be a long road to recovery and  might take a couple years but they have a lot of good stuff going for them still. 

I think aceto needs to go though. It’s time for the board and shareholders to clean house.  The comments from the chairman do inspire confidence either so he should be removed as well.",1562846241.0,2019-07-11 18:04:36.622127,,False,etict5r,False,t3_cbti6r,t1_etic5dt,/r/weedstocks/comments/cbti6r/rweedstocks_casual_daily_discussion_july_11_2019/etict5r/,5,False,weedstocks,t5_2zfqj
Gailjnh,"I'm also wondering if the illegal grow is a violation of their export agreements and wondering it those will be terminated? If so, there's not much hope for Canntrust but opportunity for other companies to jump in to fill that void.",1562847587.0,2019-07-11 18:04:36.622133,,False,etieca3,False,t3_cbti6r,t1_etic5dt,/r/weedstocks/comments/cbti6r/rweedstocks_casual_daily_discussion_july_11_2019/etieca3/,2,False,weedstocks,t5_2zfqj
Unselftitled,Don't try to reason with this curmudgeon.,1562847907.0,2019-07-11 18:04:36.622143,,False,etiepzv,False,t3_cbti6r,t1_etiehxm,/r/weedstocks/comments/cbti6r/rweedstocks_casual_daily_discussion_july_11_2019/etiepzv/,1,False,weedstocks,t5_2zfqj
FlyingCake,"Dude.. This facility was suppose to be growing weed almost 7 months ago. If anything, the license would just slow the bleeding down. Sure it might get a few % back on the day of the annoucement but that's just media exposure / algos kicking in. DD license is not going to be the rocket you are hoping it will be.",1562848404.0,2019-07-11 18:04:36.622148,,False,etifb9z,False,t3_cbti6r,t1_etiehxm,/r/weedstocks/comments/cbti6r/rweedstocks_casual_daily_discussion_july_11_2019/etifb9z/,-7,False,weedstocks,t5_2zfqj
everythings-awkward,Yeah it won't fill until market open provided you put how long it'll stay open for... if you put just that day then it'll be expired and wont fill,1562849703.0,2019-07-11 18:04:36.622153,,False,etigz17,False,t3_cbti6r,t1_etigobx,/r/weedstocks/comments/cbti6r/rweedstocks_casual_daily_discussion_july_11_2019/etigz17/,1,False,weedstocks,t5_2zfqj
-HotterThanSauce-,"I'm not sure who you trade with, but my broker would definitely place that trade for me if it still says, ""open"".",1562849834.0,2019-07-11 18:04:36.622158,,False,etih4zp,False,t3_cbti6r,t1_etigobx,/r/weedstocks/comments/cbti6r/rweedstocks_casual_daily_discussion_july_11_2019/etih4zp/,1,False,weedstocks,t5_2zfqj
Mookypooks,Lol it just dumped again,1562854811.0,2019-07-11 18:04:36.622163,,False,etims7i,False,t3_cbti6r,t1_etimjf0,/r/weedstocks/comments/cbti6r/rweedstocks_casual_daily_discussion_july_11_2019/etims7i/,1,False,weedstocks,t5_2zfqj
Styx19,"Care to share why?

Thanks in advance.",1562866844.0,2019-07-11 18:04:36.622168,,False,etj5y1f,False,t3_cbti6r,t1_etip5u8,/r/weedstocks/comments/cbti6r/rweedstocks_casual_daily_discussion_july_11_2019/etj5y1f/,1,False,weedstocks,t5_2zfqj
rbryant67,Is 13 the next key support?,1562857304.0,2019-07-11 18:04:36.622173,,False,etiq5vk,False,t3_cbti6r,t1_etiprru,/r/weedstocks/comments/cbti6r/rweedstocks_casual_daily_discussion_july_11_2019/etiq5vk/,1,False,weedstocks,t5_2zfqj
klawsveryown,"> I don't think anyone saw that coming, and by the time you realize what's going on, no matter what you're losing money anyway.

The banks and investment funds that poured money into them certainly failed their DD.

How did someone miss this obvious illegal growing?",1562861550.0,2019-07-11 18:04:36.622184,,False,etiwu1u,False,t3_cbti6r,t1_etivlr2,/r/weedstocks/comments/cbti6r/rweedstocks_casual_daily_discussion_july_11_2019/etiwu1u/,1,False,weedstocks,t5_2zfqj
OnlyMakingNoise,How's life up there? I'm in Vancouver.,1562860678.0,2019-07-11 18:04:36.622189,,False,etivfi3,False,t3_cbti6r,t1_etiv8cl,/r/weedstocks/comments/cbti6r/rweedstocks_casual_daily_discussion_july_11_2019/etivfi3/,1,False,weedstocks,t5_2zfqj
LostSoul97,"Won't the company have 36-48 months to pay off as much of the debt as they can?  And if a banking bill were to pass in that timeframe, couldn't they in theory get a large enough loan to avoid a takeover situation?  If I understand correctly, the shares serve as nothing more than collateral at this point.  I may be wrong, and I want to make clear I'm not attacking your viewpoint here.",1562864256.0,2019-07-11 18:04:36.622204,,False,etj1cuq,False,t3_cbti6r,t1_etixcdv,/r/weedstocks/comments/cbti6r/rweedstocks_casual_daily_discussion_july_11_2019/etj1cuq/,1,False,weedstocks,t5_2zfqj
cookie_n,You’re the biggest shill on this sub. Almost all of your posts bash mmen. You are either a paid basher or hold a short position. Which is it?,1562867960.0,2019-07-11 18:04:36.622210,,False,etj7xeo,False,t3_cbti6r,t1_etixeby,/r/weedstocks/comments/cbti6r/rweedstocks_casual_daily_discussion_july_11_2019/etj7xeo/,1,False,weedstocks,t5_2zfqj
mattsycakes,That's not too bad. I'm right on 9. Long term I believe Cura is the big dog and will revisit it's highs,1562865331.0,2019-07-11 18:04:36.622215,,False,etj397e,False,t3_cbti6r,t1_etj3174,/r/weedstocks/comments/cbti6r/rweedstocks_casual_daily_discussion_july_11_2019/etj397e/,1,False,weedstocks,t5_2zfqj
LuxGang,"The thing that makes me want to avoid the sector is that none of these companies are truly proven. I'm an investor, not a trader (though I have done a lot of trading in this sector because of the volatility) and I want to know my investment will be ""safe"" in 5-years time. Can't do that in this sector. Things move very fast, and a small mistake or oversight can lead to major losses or bag holding for months.

I've done my DD on VFF and look how hard it's tanking, despite being undervalued compared to peers. They released good news today, and while TRST just had horrible news less than 12 hrs ago, they are down less than VFF. It just makes no sense. 

There's too many traders flipping for 1% and I can't blame them. Again, there's no stability and too much BS happening behind the scenes. Too much stress not knowing if a stock I hold will be the target of a short report, or if they will even survive the next 5 years. I'd much rather invest in something ""boring"" that will pay me 2-6% while I wait.",1562867477.0,2019-07-11 18:04:36.622220,,False,etj73ee,False,t3_cbti6r,t1_etj6mgt,/r/weedstocks/comments/cbti6r/rweedstocks_casual_daily_discussion_july_11_2019/etj73ee/,1,False,weedstocks,t5_2zfqj
LuxGang,"My TFSA is a Dividend Growth vehicle holding only Canadian stocks (for the most part). The ultimate goal is to retire and live off dividend income (Which I understand takes $2-3 million dollars to do at 4% dividend).

TD, RY, BCE, EMA, ENB, CNR, XRE, T, WSP, ATD, WCN are the main holdings in my TFSA. Also hold WEED, VFF, VGW, and OH here, which as I mentioned, I plan to sell off except WEED.

My RRSP is for international exposure through ETF's. Only holding XAW in this one which is globally diversified except Canada.",1562867725.0,2019-07-11 18:04:36.622225,,False,etj7je5,False,t3_cbti6r,t1_etj6t1c,/r/weedstocks/comments/cbti6r/rweedstocks_casual_daily_discussion_july_11_2019/etj7je5/,1,False,weedstocks,t5_2zfqj
darksider902,No. I've been holding both for about two years.,1562867564.0,2019-07-11 18:04:36.622230,,False,etj793u,False,t3_cbti6r,t1_etj723n,/r/weedstocks/comments/cbti6r/rweedstocks_casual_daily_discussion_july_11_2019/etj793u/,1,False,weedstocks,t5_2zfqj
v0xb0x_,"ACRG is trading at 17.12 CAD, 0.58 shares of WEED per ACRG share, 17.12 / 0.58 = 29.50$.",1562867772.0,2019-07-11 18:04:36.622235,,False,etj7m9d,False,t3_cbti6r,t1_etj7j6u,/r/weedstocks/comments/cbti6r/rweedstocks_casual_daily_discussion_july_11_2019/etj7m9d/,1,False,weedstocks,t5_2zfqj
SpartanNitro1,Smart man,1562847261.0,2019-07-11 18:04:36.622240,,False,etidyj6,False,t3_cbti6r,t1_etid4hk,/r/weedstocks/comments/cbti6r/rweedstocks_casual_daily_discussion_july_11_2019/etidyj6/,0,False,weedstocks,t5_2zfqj
mariyachta,I was also excited. Already down from 15.50 to 14.50,1562849462.0,2019-07-11 18:04:36.622245,,False,etigns2,False,t3_cbti6r,t1_etigm88,/r/weedstocks/comments/cbti6r/rweedstocks_casual_daily_discussion_july_11_2019/etigns2/,1,False,weedstocks,t5_2zfqj
Holdontoyourweed,settle down,1562854114.0,2019-07-11 18:04:36.622250,,False,etily1n,False,t3_cbti6r,t1_etiktjl,/r/weedstocks/comments/cbti6r/rweedstocks_casual_daily_discussion_july_11_2019/etily1n/,3,False,weedstocks,t5_2zfqj
IWanaTalk2Samson,90% + downside never happened lol if this is what that person is referring to.,1562854254.0,2019-07-11 18:04:36.622254,,False,etim443,False,t3_cbti6r,t1_etila7a,/r/weedstocks/comments/cbti6r/rweedstocks_casual_daily_discussion_july_11_2019/etim443/,1,False,weedstocks,t5_2zfqj
mools81,Not from hindenburg. At the time of tweeting July 9th it was damn close to a 750 million dollar market cap. I hope its bot the case bu damn this has been falling like a rock and agressively.,1562854361.0,2019-07-11 18:04:36.622260,,False,etim8n4,False,t3_cbti6r,t1_etila7a,/r/weedstocks/comments/cbti6r/rweedstocks_casual_daily_discussion_july_11_2019/etim8n4/,1,False,weedstocks,t5_2zfqj
ChronicMasterBlazer,Who knows... it’s risky because we don’t know the full consequences yet. Some of those things could be a possibility,1562855283.0,2019-07-11 18:04:36.622265,,False,etind8u,False,t3_cbti6r,t1_etin7gb,/r/weedstocks/comments/cbti6r/rweedstocks_casual_daily_discussion_july_11_2019/etind8u/,1,False,weedstocks,t5_2zfqj
bigpappy1999,Huh is that pig Latin?,1562858809.0,2019-07-11 18:04:36.622271,,False,etisgxi,False,t3_cbti6r,t1_etin7gb,/r/weedstocks/comments/cbti6r/rweedstocks_casual_daily_discussion_july_11_2019/etisgxi/,0,False,weedstocks,t5_2zfqj
Oi_Kimchi,I would absolutely get out of you've only got 65 shares.,1562862199.0,2019-07-11 18:04:36.622275,,False,etixvqe,False,t3_cbti6r,t1_etiptm8,/r/weedstocks/comments/cbti6r/rweedstocks_casual_daily_discussion_july_11_2019/etixvqe/,1,False,weedstocks,t5_2zfqj
SQUATCH_HUNTARD,65 shares?? LOL,1562858190.0,2019-07-11 18:04:36.622280,,False,etirilt,False,t3_cbti6r,t1_etiptm8,/r/weedstocks/comments/cbti6r/rweedstocks_casual_daily_discussion_july_11_2019/etirilt/,-2,False,weedstocks,t5_2zfqj
WRONG_PREDICTION,"OGI was 9.50 two days ago! Down 13% on no news. I was being far reaching, obviously CANTTRUST has fallen more since it's run by a bunch of idiots who deserve to go to jail.",1562860176.0,2019-07-11 18:04:36.622291,,False,etium48,False,t3_cbti6r,t1_etitmqu,/r/weedstocks/comments/cbti6r/rweedstocks_casual_daily_discussion_july_11_2019/etium48/,2,False,weedstocks,t5_2zfqj
WRONG_PREDICTION,hahaha it's too been too long ;),1562866346.0,2019-07-11 18:04:36.622296,,False,etj51z1,False,t3_cbti6r,t1_etj4s16,/r/weedstocks/comments/cbti6r/rweedstocks_casual_daily_discussion_july_11_2019/etj51z1/,1,False,weedstocks,t5_2zfqj
Raptorswon,How high is high,1562867709.0,2019-07-11 18:04:36.622302,,False,etj7icu,False,t3_cbti6r,t1_etj5y6j,/r/weedstocks/comments/cbti6r/rweedstocks_casual_daily_discussion_july_11_2019/etj7icu/,1,False,weedstocks,t5_2zfqj
kiddchiu,Even if they report good numbers itll drop lol,1562857729.0,2019-07-11 18:04:36.622308,,False,etiqt1n,False,t3_cbti6r,t1_etiqjmd,/r/weedstocks/comments/cbti6r/rweedstocks_casual_daily_discussion_july_11_2019/etiqt1n/,3,False,weedstocks,t5_2zfqj
