author,body,created_utc,date_uploaded,distinguished,edited,id,is_submitter,link_id,parent_id,permalink,score,stickied,subreddit,subreddit_id
ISLAMISNTPEACEFUL,Mind blowing that this is even a point of contention still. Instead they'll quibble about how to spend the tax revenue for a million hours rather than just legalize it.,1562791818.0,2019-07-11 18:04:36.476677,,False,etgingx,False,t3_cbl8p0,t3_cbl8p0,/r/weedstocks/comments/cbl8p0/republicans_and_democrats_agree_at_landmark/etgingx/,70,False,weedstocks,t5_2zfqj
Danskiiii,The best thing any of us can do right now is to help share these articles on social media.,1562795117.0,2019-07-11 18:04:36.476685,,False,etgntry,False,t3_cbl8p0,t3_cbl8p0,/r/weedstocks/comments/cbl8p0/republicans_and_democrats_agree_at_landmark/etgntry/,20,False,weedstocks,t5_2zfqj
Trailberry,"> ...But analysts have warned that legislation affecting the cannabis industry could run into trouble in the Senate, given factors such as Senate Majority Leader Mitch McConnell’s wary stance. Last year, the Kentucky Republican applauded a farm bill that legalized industrial hemp, but he described marijuana as hemp’s “illicit cousin which I choose not to embrace.”

He's probably the biggest congressional cock block we've ever seen and not just on this matter.",1562814958.0,2019-07-11 18:04:36.476690,,False,ethgn3o,False,t3_cbl8p0,t3_cbl8p0,/r/weedstocks/comments/cbl8p0/republicans_and_democrats_agree_at_landmark/ethgn3o/,18,False,weedstocks,t5_2zfqj
I_Zeig_I,K. They gunna do something about it or do they feel that earned them enough PR on the topic?,1562808298.0,2019-07-11 18:04:36.476695,,False,eth7xd3,False,t3_cbl8p0,t3_cbl8p0,/r/weedstocks/comments/cbl8p0/republicans_and_democrats_agree_at_landmark/eth7xd3/,7,False,weedstocks,t5_2zfqj
unknownstranger2,"""FREE THE WEED""",1562808941.0,2019-07-11 18:04:36.476700,,False,eth8sof,False,t3_cbl8p0,t3_cbl8p0,/r/weedstocks/comments/cbl8p0/republicans_and_democrats_agree_at_landmark/eth8sof/,3,False,weedstocks,t5_2zfqj
2high4life,These stupid hang ups are gonna prevent legalization from happening in our life time. Just allow people to grow 3-5 plants in home. Don’t put a limit on the licenses needed to distribute. Don’t allow the same company’s corner the market by owning both grow houses and store fronts. Reduce the cost of a license get rid of the ridiculous application fee. Allow banks to store their funds. Have federal standards for quality. Stop jobs from discriminating future employees with drug screenings that come up positive for weed. And stop worrying about creating a new weed breathalyzer. Cops should be able to tell if the driver is high without new tech. Have a price standard that’s lower then current street value while having a reasonable sales tax that’s not overly greedy. By cutting out transportation fees and multiple middle men there should be enough money for everyone to be happy. They just need to stop being so god damn greedy. Weed is a cash cow but no one will buy legal if street value is half the cost.,1562839169.0,2019-07-11 18:04:36.476704,,False,eti55j1,False,t3_cbl8p0,t3_cbl8p0,/r/weedstocks/comments/cbl8p0/republicans_and_democrats_agree_at_landmark/eti55j1/,1,False,weedstocks,t5_2zfqj
cannainform2,"'There is a less than 25% chance that the current Congress will enact the STATES Act or a separate bill that would protect banks that work with the pot industry, according to Height Capital Markets analysts. “Ultimately, the political divide between the House and Senate will serve as the greatest roadblock,” the Height team wrote in a recent note.'",1562852182.0,2019-07-11 18:04:36.476709,,False,etijqla,False,t3_cbl8p0,t3_cbl8p0,/r/weedstocks/comments/cbl8p0/republicans_and_democrats_agree_at_landmark/etijqla/,1,False,weedstocks,t5_2zfqj
bigbassdaddy,Nothing will pass the senate as long a bitch McConnell is Leader.,1562856948.0,2019-07-11 18:04:36.476714,,False,etipmcp,False,t3_cbl8p0,t3_cbl8p0,/r/weedstocks/comments/cbl8p0/republicans_and_democrats_agree_at_landmark/etipmcp/,1,False,weedstocks,t5_2zfqj
BlinkshotTV,"Idk I watched over an hour of the hearing and basically they are all in favor of it. The only thing really preventing it at this point is corruption and greed. Although now with the 2020 election coming up, they will probably federally legalize it before than so that Trump's reelection campaign goes smoothly. 
IE: federally legalize weed for the cost of world war 3",1562795066.0,2019-07-11 18:04:36.476718,,False,etgnqon,False,t3_cbl8p0,t1_etgingx,/r/weedstocks/comments/cbl8p0/republicans_and_democrats_agree_at_landmark/etgnqon/,30,False,weedstocks,t5_2zfqj
ocular__patdown,Maybe? Definitely.,1562792745.0,2019-07-11 18:04:36.476723,,False,etgk4pv,False,t3_cbl8p0,t1_etgingx,/r/weedstocks/comments/cbl8p0/republicans_and_democrats_agree_at_landmark/etgk4pv/,2,False,weedstocks,t5_2zfqj
Biobot775,"""I'm angry and old, fuck you. Yes, YOU in particular.""

-Mitch McConnell, to whatever he's looking at",1562815717.0,2019-07-11 18:04:36.476728,,False,ethhkpw,False,t3_cbl8p0,t1_ethgn3o,/r/weedstocks/comments/cbl8p0/republicans_and_democrats_agree_at_landmark/ethhkpw/,15,False,weedstocks,t5_2zfqj
DahmerRape,"Mitch the Bitch prefers his own cousins, not illicit ones.",1562845808.0,2019-07-11 18:04:36.476732,,False,eticbcf,False,t3_cbl8p0,t1_ethgn3o,/r/weedstocks/comments/cbl8p0/republicans_and_democrats_agree_at_landmark/eticbcf/,4,False,weedstocks,t5_2zfqj
faintdeception,"In our lifetime? How old are you? 90?

There's been so much progress made in the US in the last 10 years, I wouldn't be surprised if it's federally legal in the next 5-10 years.",1562844118.0,2019-07-11 18:04:36.476737,,False,etiaeru,False,t3_cbl8p0,t1_eti55j1,/r/weedstocks/comments/cbl8p0/republicans_and_democrats_agree_at_landmark/etiaeru/,2,False,weedstocks,t5_2zfqj
SpakenBacon,World War Weed,1562800310.0,2019-07-11 18:04:36.476742,,False,etgwegf,False,t3_cbl8p0,t1_etgnqon,/r/weedstocks/comments/cbl8p0/republicans_and_democrats_agree_at_landmark/etgwegf/,20,False,weedstocks,t5_2zfqj
DirectlyTalkingToYou,"They just want to make sure that they all get a piece of the pie. Fine by me, I just wanna know where the pie is at.",1562811972.0,2019-07-11 18:04:36.476747,,False,ethcsqq,False,t3_cbl8p0,t1_etgnqon,/r/weedstocks/comments/cbl8p0/republicans_and_democrats_agree_at_landmark/ethcsqq/,13,False,weedstocks,t5_2zfqj
Timmy2knuckles,"Wait, I thought World War 3 was supposed to start after the first election? Now we have to have to wait for 2020? Is he waiting until after his reelection to crash the economy too?",1562797903.0,2019-07-11 18:04:36.476752,,False,etgsgzu,False,t3_cbl8p0,t1_etgnqon,/r/weedstocks/comments/cbl8p0/republicans_and_democrats_agree_at_landmark/etgsgzu/,3,False,weedstocks,t5_2zfqj
Tylergame,Greed for the potential for tax revenue?  Gee if that’s true just imagine the revenue companies will be receiving if legalization occurs,1562812885.0,2019-07-11 18:04:36.476757,,False,ethdzqy,False,t3_cbl8p0,t1_etgnqon,/r/weedstocks/comments/cbl8p0/republicans_and_democrats_agree_at_landmark/ethdzqy/,1,False,weedstocks,t5_2zfqj
Armox,Trumps evangelical base would abandon him if he did this.,1562808467.0,2019-07-11 18:04:36.476762,,False,eth85oe,False,t3_cbl8p0,t1_etgnqon,/r/weedstocks/comments/cbl8p0/republicans_and_democrats_agree_at_landmark/eth85oe/,-5,False,weedstocks,t5_2zfqj
prometheus3333,[I've got some pie for you ...](https://www.youtube.com/watch?v=dQw4w9WgXcQ),1562812749.0,2019-07-11 18:04:36.476767,,False,ethdte6,False,t3_cbl8p0,t1_ethcsqq,/r/weedstocks/comments/cbl8p0/republicans_and_democrats_agree_at_landmark/ethdte6/,3,False,weedstocks,t5_2zfqj
Rekka1212,On the brink of a recession and you say this lolol.,1562799993.0,2019-07-11 18:04:36.476772,,False,etgvvwj,False,t3_cbl8p0,t1_etgsgzu,/r/weedstocks/comments/cbl8p0/republicans_and_democrats_agree_at_landmark/etgvvwj/,-1,False,weedstocks,t5_2zfqj
BlinkshotTV,"Greed for potential Tax revenue? No.. Greed as in private insurance, private prisons, and a bunch of other industries that are profiting off of the failed drug war, racism, and uneducated public.",1562813127.0,2019-07-11 18:04:36.476777,,False,etheb25,False,t3_cbl8p0,t1_ethdzqy,/r/weedstocks/comments/cbl8p0/republicans_and_democrats_agree_at_landmark/etheb25/,5,False,weedstocks,t5_2zfqj
unknownstranger2,Plenty of Christians smoke weed.,1562808860.0,2019-07-11 18:04:36.476782,,False,eth8or3,False,t3_cbl8p0,t1_eth85oe,/r/weedstocks/comments/cbl8p0/republicans_and_democrats_agree_at_landmark/eth8or3/,8,False,weedstocks,t5_2zfqj
Gehirnkrampf,Which is stupid because jesus used cannabis,1562823336.0,2019-07-11 18:04:36.476787,,False,ethpvyj,False,t3_cbl8p0,t1_eth85oe,/r/weedstocks/comments/cbl8p0/republicans_and_democrats_agree_at_landmark/ethpvyj/,1,False,weedstocks,t5_2zfqj
ISLAMISNTPEACEFUL,Disagree. My parents are Christian fundamentalist. When I was younger and got caught smoking pot they freaked out. Now my parents both take CBD for joint pain. They don't even care that I habitually smoke pot. I mean it helps that I'm an adult who has a job at a fortune 500 company and own a couple houses but still... Parents are parents.,1562863096.0,2019-07-11 18:04:36.476792,,False,etizcrg,False,t3_cbl8p0,t1_eth85oe,/r/weedstocks/comments/cbl8p0/republicans_and_democrats_agree_at_landmark/etizcrg/,1,False,weedstocks,t5_2zfqj
Gregory-Pecking,"Lol what are they going to do, vote Democrat?",1562843549.0,2019-07-11 18:04:36.476796,,False,eti9trd,False,t3_cbl8p0,t1_eth85oe,/r/weedstocks/comments/cbl8p0/republicans_and_democrats_agree_at_landmark/eti9trd/,0,False,weedstocks,t5_2zfqj
liltooly,"hardcore southern conservatives would abandon him, but who gives af about them anyway.",1562828529.0,2019-07-11 18:04:36.476800,,False,ethvcyv,False,t3_cbl8p0,t1_eth85oe,/r/weedstocks/comments/cbl8p0/republicans_and_democrats_agree_at_landmark/ethvcyv/,-1,False,weedstocks,t5_2zfqj
torchboy1661,Ricksy click.,1562825829.0,2019-07-11 18:04:36.476805,,False,eths8sz,False,t3_cbl8p0,t1_ethdte6,/r/weedstocks/comments/cbl8p0/republicans_and_democrats_agree_at_landmark/eths8sz/,1,False,weedstocks,t5_2zfqj
redditpossible,Weed will save us!,1562801845.0,2019-07-11 18:04:36.476810,,False,etgytwb,False,t3_cbl8p0,t1_etgvvwj,/r/weedstocks/comments/cbl8p0/republicans_and_democrats_agree_at_landmark/etgytwb/,5,False,weedstocks,t5_2zfqj
Timmy2knuckles,We've been on the brink since the day Trump took office. Any day now lol.,1562802512.0,2019-07-11 18:04:36.476815,,False,etgzvny,False,t3_cbl8p0,t1_etgvvwj,/r/weedstocks/comments/cbl8p0/republicans_and_democrats_agree_at_landmark/etgzvny/,3,False,weedstocks,t5_2zfqj
ISLAMISNTPEACEFUL,Prema bears going to perma bear. How's that gold from rosland capital?,1562863009.0,2019-07-11 18:04:36.476819,,False,etiz78o,False,t3_cbl8p0,t1_etgvvwj,/r/weedstocks/comments/cbl8p0/republicans_and_democrats_agree_at_landmark/etiz78o/,1,False,weedstocks,t5_2zfqj
SonofYeshua,You rang?,1562812633.0,2019-07-11 18:04:36.476823,,False,ethdnwe,False,t3_cbl8p0,t1_eth8or3,/r/weedstocks/comments/cbl8p0/republicans_and_democrats_agree_at_landmark/ethdnwe/,4,False,weedstocks,t5_2zfqj
Kealle89,Not enough where it’s socially accepted.,1562811844.0,2019-07-11 18:04:36.476865,,False,ethcms9,False,t3_cbl8p0,t1_eth8or3,/r/weedstocks/comments/cbl8p0/republicans_and_democrats_agree_at_landmark/ethcms9/,1,False,weedstocks,t5_2zfqj
ThunkAboutIt,The Devil’s lettuce needs a rebranding ..,1562832334.0,2019-07-11 18:04:36.476870,,False,ethza45,False,t3_cbl8p0,t1_eth8or3,/r/weedstocks/comments/cbl8p0/republicans_and_democrats_agree_at_landmark/ethza45/,1,False,weedstocks,t5_2zfqj
ivigilanteblog,"We've been on the brink every year for 300 years. Occasionally, doomsayers are temporarily right and this justifies, in their minds, all the fear of each preceding year when they were wrong. Politics is thankfully irrelevant; fearmongering goes both ways, left and right. And up, down, and on the Z axis, and interdimensionally.",1562851706.0,2019-07-11 18:04:36.476875,,False,etij82q,False,t3_cbl8p0,t1_etgzvny,/r/weedstocks/comments/cbl8p0/republicans_and_democrats_agree_at_landmark/etij82q/,2,False,weedstocks,t5_2zfqj
totallynotbutchvig,If only McConnell wasn't sitting in the way.,1562798244.0,2019-07-11 18:04:36.476983,,False,etgt174,False,t3_cbndsj,t3_cbndsj,/r/weedstocks/comments/cbndsj/us_lawmakers_look_to_legalize_pot_in_historic/etgt174/,35,False,weedstocks,t5_2zfqj
IlliVanilli420,Trump's gonna get it done to make it look like his term was a success,1562804709.0,2019-07-11 18:04:36.476988,,False,eth318d,False,t3_cbndsj,t3_cbndsj,/r/weedstocks/comments/cbndsj/us_lawmakers_look_to_legalize_pot_in_historic/eth318d/,18,False,weedstocks,t5_2zfqj
SQUINT230,"The Grim Reaper needs to go sooner than later, the senate does as he says ☠️",1562798223.0,2019-07-11 18:04:36.477003,,False,etgszx5,False,t3_cbndsj,t3_cbndsj,/r/weedstocks/comments/cbndsj/us_lawmakers_look_to_legalize_pot_in_historic/etgszx5/,12,False,weedstocks,t5_2zfqj
furcifer89,Put a bill forward to legalize it in the house. Republicans and democrats alike will be terrified to have a vote on the wrong side of public opinion before an election year. And for those that vote in favor they get a great item to run on. Something like this could actually gain steam in the senate and with Mitch having a real contender this election season it may force his hand to bring it to vote.,1562811478.0,2019-07-11 18:04:36.477008,,False,ethc5hv,False,t3_cbndsj,t3_cbndsj,/r/weedstocks/comments/cbndsj/us_lawmakers_look_to_legalize_pot_in_historic/ethc5hv/,12,False,weedstocks,t5_2zfqj
GilElCentauro,"Guys... I said from the beginning that I'm Puerto Rican, I can't vote. I just want to smoke weed free. Stop being butt hurt and vote in the next elections if want another thing. The subject here is legalization of weed. 

If he doesn't legalize weed than don't vote for him.",1562854714.0,2019-07-11 18:04:36.477013,,False,etimnzb,False,t3_cbndsj,t3_cbndsj,/r/weedstocks/comments/cbndsj/us_lawmakers_look_to_legalize_pot_in_historic/etimnzb/,2,False,weedstocks,t5_2zfqj
heyitsanty,Again,1562803329.0,2019-07-11 18:04:36.477018,,False,eth13p0,False,t3_cbndsj,t3_cbndsj,/r/weedstocks/comments/cbndsj/us_lawmakers_look_to_legalize_pot_in_historic/eth13p0/,1,False,weedstocks,t5_2zfqj
GilElCentauro,"Trump doesn't have to legalize weed during his term to win. But if he does, I would vote the shit out of him. And I'm Puerto Rican.",1562811690.0,2019-07-11 18:04:36.477022,,False,ethcfk0,False,t3_cbndsj,t3_cbndsj,/r/weedstocks/comments/cbndsj/us_lawmakers_look_to_legalize_pot_in_historic/ethcfk0/,0,False,weedstocks,t5_2zfqj
seebz69,Right! Whats his deal?! all in on hemp yet he opposes marijuana legalization?,1562798384.0,2019-07-11 18:04:36.477027,,False,etgt9j7,True,t3_cbndsj,t1_etgt174,/r/weedstocks/comments/cbndsj/us_lawmakers_look_to_legalize_pot_in_historic/etgt9j7/,18,False,weedstocks,t5_2zfqj
SQUINT230,He wants nothing to stand in the way of him he’s from Kentucky and that is why a bunch of leaders went there to look at a hemp farm he doesn’t want cannabis to interfere with his hemp Profits it’s all about him and his Chinese wife And her family that owns a huge shipping manufacturer in China . Mitch McConnell is about as corrupt as Donald Trump,1562799472.0,2019-07-11 18:04:36.477032,,False,etgv12a,False,t3_cbndsj,t1_etgt174,/r/weedstocks/comments/cbndsj/us_lawmakers_look_to_legalize_pot_in_historic/etgv12a/,6,False,weedstocks,t5_2zfqj
bigbassdaddy,"Agreed.  But I doubt Trump would sign anything either as long as Pence is VP.  Pence is a rabid anti-cannabis warrior and I'm sure he'd influence the orange shit-stain just as he has done with abortion (cuz you know, Trump's probably facilitated dozens of abortions).",1562857301.0,2019-07-11 18:04:36.477037,,False,etiq5qf,False,t3_cbndsj,t1_etgt174,/r/weedstocks/comments/cbndsj/us_lawmakers_look_to_legalize_pot_in_historic/etiq5qf/,2,False,weedstocks,t5_2zfqj
IDreamOfLoveLost,"If the GOP Senators didn't agree with what he's been doing, he wouldn't be in a position to do it. Hopefully in the 2020 elections we'll see some more progressive stances on both sides.",1562810013.0,2019-07-11 18:04:36.477043,,False,etha8ek,False,t3_cbndsj,t1_etgt174,/r/weedstocks/comments/cbndsj/us_lawmakers_look_to_legalize_pot_in_historic/etha8ek/,1,False,weedstocks,t5_2zfqj
DuncanMcCockner,"CNN: why marijuana legalization is bad for women and minorities.


Ayy first gold. Thank you!!",1562805151.0,2019-07-11 18:04:36.477047,,1562812214.0,eth3n8t,False,t3_cbndsj,t1_eth318d,/r/weedstocks/comments/cbndsj/us_lawmakers_look_to_legalize_pot_in_historic/eth3n8t/,51,False,weedstocks,t5_2zfqj
fib16,Wouldn’t you be ok with that if you’re an investor?,1562811198.0,2019-07-11 18:04:36.477052,,False,ethbs7a,False,t3_cbndsj,t1_eth318d,/r/weedstocks/comments/cbndsj/us_lawmakers_look_to_legalize_pot_in_historic/ethbs7a/,3,False,weedstocks,t5_2zfqj
dghaze,"I agree! If he is down in the polls close to election, I think legalization will be his secret weapon to win",1562858233.0,2019-07-11 18:04:36.477058,,False,etirkyd,False,t3_cbndsj,t1_eth318d,/r/weedstocks/comments/cbndsj/us_lawmakers_look_to_legalize_pot_in_historic/etirkyd/,1,False,weedstocks,t5_2zfqj
Gailjnh,"He is up for reelection next year,hopefully.......",1562799059.0,2019-07-11 18:04:36.477062,,False,etguctv,False,t3_cbndsj,t1_etgszx5,/r/weedstocks/comments/cbndsj/us_lawmakers_look_to_legalize_pot_in_historic/etguctv/,9,False,weedstocks,t5_2zfqj
asafum,"If I remember correctly this fear is why NY is going to back off for a year or more, they don't want to risk their re-elections... 

I'm still salty about the results, but I know there is 0% chance for long island anyway even if it does pass here. Leadership in Nassau and Suffolk said they are opting out of any legalization...",1562813093.0,2019-07-11 18:04:36.477067,,False,ethe9h4,False,t3_cbndsj,t1_ethc5hv,/r/weedstocks/comments/cbndsj/us_lawmakers_look_to_legalize_pot_in_historic/ethe9h4/,1,False,weedstocks,t5_2zfqj
MrCraven,"Dont let your love of weed make that the deciding factor for your vote, its immature and irresponsible. It would be a small win for him in the cesspool of garbage he has poured into this country. And if he were to claim it as his win, better be damn sure it would be so tightly controlled as to make his fuck buddies ever wealthier.",1562813923.0,2019-07-11 18:04:36.477072,,False,ethfbwd,False,t3_cbndsj,t1_ethcfk0,/r/weedstocks/comments/cbndsj/us_lawmakers_look_to_legalize_pot_in_historic/ethfbwd/,6,False,weedstocks,t5_2zfqj
mynameehjev,are you brainwashed? How can you STILL consider voting for trump??,1562835418.0,2019-07-11 18:04:36.477077,,False,eti1oxj,False,t3_cbndsj,t1_ethcfk0,/r/weedstocks/comments/cbndsj/us_lawmakers_look_to_legalize_pot_in_historic/eti1oxj/,1,False,weedstocks,t5_2zfqj
apmdude,"I'm not claiming any relevance, but John Boehner had this to say in April 2019:
https://www.washingtonexaminer.com/news/john-boehner-our-nation-is-blessed-by-mitch-mcconnell

With the Canopy deal, the time frame, the republican BOD of Acreage...I wouldn't be surprised if we get surprised",1562799187.0,2019-07-11 18:04:36.477082,,False,etgukhu,False,t3_cbndsj,t1_etgt9j7,/r/weedstocks/comments/cbndsj/us_lawmakers_look_to_legalize_pot_in_historic/etgukhu/,12,False,weedstocks,t5_2zfqj
totallynotbutchvig,"Well, big pharma dumps cash into McConnell's campaign coffers, and between Mitch and Elaine Chao, it's really hard to say which one is more unethical so I'm sure they have some clever tricks to extract more.",1562799462.0,2019-07-11 18:04:36.477087,,False,etgv0hz,False,t3_cbndsj,t1_etgt9j7,/r/weedstocks/comments/cbndsj/us_lawmakers_look_to_legalize_pot_in_historic/etgv0hz/,13,False,weedstocks,t5_2zfqj
shadow_dna360,It's all in the money,1562799152.0,2019-07-11 18:04:36.477092,,False,etguidh,False,t3_cbndsj,t1_etgt9j7,/r/weedstocks/comments/cbndsj/us_lawmakers_look_to_legalize_pot_in_historic/etguidh/,7,False,weedstocks,t5_2zfqj
Viking4949,Exactly.  Marijuana would compete with hemp.,1562799521.0,2019-07-11 18:04:36.477096,,False,etgv3ui,False,t3_cbndsj,t1_etgt9j7,/r/weedstocks/comments/cbndsj/us_lawmakers_look_to_legalize_pot_in_historic/etgv3ui/,-5,False,weedstocks,t5_2zfqj
beerasap,Dude. Punctuation.,1562809714.0,2019-07-11 18:04:36.477102,,False,eth9u3f,False,t3_cbndsj,t1_etgv12a,/r/weedstocks/comments/cbndsj/us_lawmakers_look_to_legalize_pot_in_historic/eth9u3f/,31,False,weedstocks,t5_2zfqj
dooanddee,"There is one person who can influence Mitch McConnell and that is President Trump. 

All Trump has to do is answer a question from a reporter regarding the legalization of cannabis and reply by saying, ""Cannabis legalization? Maybe that's something we should take a look at.""",1562800695.0,2019-07-11 18:04:36.477106,,False,etgx0jj,False,t3_cbndsj,t1_etgv12a,/r/weedstocks/comments/cbndsj/us_lawmakers_look_to_legalize_pot_in_historic/etgx0jj/,6,False,weedstocks,t5_2zfqj
ScrubLord1008,"He wants nothing to stand in the way of his own interests. He’s from Kentucky, and that’s why a bunch of leaders went there to look at a hemp farm. He doesn’t want Cannabis to interfere with his hemp profits. It’s all about him, his Chinese wife, and her family that owns a huge shipping manufacturer in China. Mitch McConnell is about as corrupt as Donald Trump. FTFY",1562863971.0,2019-07-11 18:04:36.477112,,False,etj0uno,False,t3_cbndsj,t1_etgv12a,/r/weedstocks/comments/cbndsj/us_lawmakers_look_to_legalize_pot_in_historic/etj0uno/,1,False,weedstocks,t5_2zfqj
totallynotbutchvig,[Trump's private abortion policy is different from his public abortion policy.](https://www.courtlistener.com/docket/4154484/1/katie-johnson-v-donald-j-trump/),1562858186.0,2019-07-11 18:04:36.477248,,False,etiridy,False,t3_cbndsj,t1_etiq5qf,/r/weedstocks/comments/cbndsj/us_lawmakers_look_to_legalize_pot_in_historic/etiridy/,1,False,weedstocks,t5_2zfqj
Mybodyisntmine,"I’ll probably get downvoted for admitting this, but I definitely laughed at this comment.",1562805369.0,2019-07-11 18:04:36.481312,,False,eth3xsb,False,t3_cbndsj,t1_eth3n8t,/r/weedstocks/comments/cbndsj/us_lawmakers_look_to_legalize_pot_in_historic/eth3xsb/,29,False,weedstocks,t5_2zfqj
seebz69,"Gold worthy. This is too damn good!😂 I would but well.. you know.. TRST

EDIT: NEVERMIND I GOT YOU!",1562811461.0,2019-07-11 18:04:36.481335,,1562814908.0,ethc4pz,True,t3_cbndsj,t1_eth3n8t,/r/weedstocks/comments/cbndsj/us_lawmakers_look_to_legalize_pot_in_historic/ethc4pz/,3,False,weedstocks,t5_2zfqj
BlueR1,Truuuuuu,1562842481.0,2019-07-11 18:04:36.481340,,False,eti8pes,False,t3_cbndsj,t1_eth3n8t,/r/weedstocks/comments/cbndsj/us_lawmakers_look_to_legalize_pot_in_historic/eti8pes/,2,False,weedstocks,t5_2zfqj
Mace109,"If it’s the largest issue for him or someone like him, then voting for someone that supports legalization isn’t really immature or irresponsible. It’s just that you 2 don’t have the same values or ideals. This I why every citizen, minus some outliers, gets to vote. We need to stop trying to tell people how to think and be more accepting of other views and look at it from that point of view.",1562821470.0,2019-07-11 18:04:36.481346,,False,etho1kt,False,t3_cbndsj,t1_ethfbwd,/r/weedstocks/comments/cbndsj/us_lawmakers_look_to_legalize_pot_in_historic/etho1kt/,5,False,weedstocks,t5_2zfqj
GilElCentauro,"I wouldn't be his friend. But the economy is doing good, racists will always exist and I would be able to smoke weed free of consequences! Either way, I'm Puerto Rican so I cant vote.",1562814627.0,2019-07-11 18:04:36.481351,,False,ethg87v,False,t3_cbndsj,t1_ethfbwd,/r/weedstocks/comments/cbndsj/us_lawmakers_look_to_legalize_pot_in_historic/ethg87v/,0,False,weedstocks,t5_2zfqj
GilElCentauro,I can't...,1562845294.0,2019-07-11 18:04:36.481356,,False,etibp4h,False,t3_cbndsj,t1_eti1oxj,/r/weedstocks/comments/cbndsj/us_lawmakers_look_to_legalize_pot_in_historic/etibp4h/,1,False,weedstocks,t5_2zfqj
seebz69,"Anytime Boehner opens his mouth, it’s wise to listen carefully.",1562801122.0,2019-07-11 18:04:36.481363,,False,etgxoo8,True,t3_cbndsj,t1_etgukhu,/r/weedstocks/comments/cbndsj/us_lawmakers_look_to_legalize_pot_in_historic/etgxoo8/,5,False,weedstocks,t5_2zfqj
SQUINT230,The only way that is happening is if trump believes it will help him win election,1562800806.0,2019-07-11 18:04:36.481368,,False,etgx70e,False,t3_cbndsj,t1_etgx0jj,/r/weedstocks/comments/cbndsj/us_lawmakers_look_to_legalize_pot_in_historic/etgx70e/,7,False,weedstocks,t5_2zfqj
Shotgun516,"People dont think Trump is smart, but he is. He knows what's going on with the MJ industries and legalizing it or at least proposing to legalize it will make him look great",1562858519.0,2019-07-11 18:04:36.481373,,False,etis0tr,False,t3_cbndsj,t1_etgx0jj,/r/weedstocks/comments/cbndsj/us_lawmakers_look_to_legalize_pot_in_historic/etis0tr/,1,False,weedstocks,t5_2zfqj
SQUINT230,Thanks I was drinking 🤭,1562864663.0,2019-07-11 18:04:36.481379,,False,etj22nq,False,t3_cbndsj,t1_etj0uno,/r/weedstocks/comments/cbndsj/us_lawmakers_look_to_legalize_pot_in_historic/etj22nq/,1,False,weedstocks,t5_2zfqj
bigbassdaddy,His public one is Pence's.,1562858621.0,2019-07-11 18:04:36.481385,,False,etis6e0,False,t3_cbndsj,t1_etiridy,/r/weedstocks/comments/cbndsj/us_lawmakers_look_to_legalize_pot_in_historic/etis6e0/,1,False,weedstocks,t5_2zfqj
DuncanMcCockner,"Yeah it was a risky comment for a lot of subs. Hope people just see it as a joke, wasn’t meant to be anything more than that haha",1562805445.0,2019-07-11 18:04:36.481390,,False,eth41jm,False,t3_cbndsj,t1_eth3xsb,/r/weedstocks/comments/cbndsj/us_lawmakers_look_to_legalize_pot_in_historic/eth41jm/,20,False,weedstocks,t5_2zfqj
DuncanMcCockner,Appreciate you!!,1562816260.0,2019-07-11 18:04:36.481396,,False,ethi8gc,False,t3_cbndsj,t1_ethc4pz,/r/weedstocks/comments/cbndsj/us_lawmakers_look_to_legalize_pot_in_historic/ethi8gc/,2,False,weedstocks,t5_2zfqj
