author,body,created_utc,date_uploaded,distinguished,edited,id,is_submitter,link_id,parent_id,permalink,score,stickied,subreddit,subreddit_id
illangai_capital,I have 15000 shares in Canntrust. What I meant to say is there are tons who sold at major loss and now want revenge and see the company go 6ft under so they feel justified in selling their loss. Many posts of users saying I sold at loss + need to lose their license now (or else I sold for no reason).,1562800906.0,2019-07-11 18:04:36.702358,,False,etgxck1,False,t3_cblpht,t1_etgsh9b,/r/weedstocks/comments/cblpht/rweedstocks_after_hours_discussion_july_10_2019/etgxck1/,2,False,weedstocks,t5_2zfqj
mikesmegabits,"So other than growing in spaces that weren't authorized yet, what else has changed? Once this blows over (we've seen a few things blow over in this sector) then they should be able to continue executing. Just that big question of if they will keep the licenses. I personally would think they'll pay a fine or something. (Disclosure: not a trst holder)",1562798211.0,2019-07-11 18:04:36.702363,,False,etgsz6s,False,t3_cblpht,t1_etgsh9b,/r/weedstocks/comments/cblpht/rweedstocks_after_hours_discussion_july_10_2019/etgsz6s/,1,False,weedstocks,t5_2zfqj
throwaway2461357,"It's been flaming dogshit since before their fins. Their margins were trash, they couldn't give their weed away. They had ZERO vision as a company. Check the investor deck, no commitment to a business model, just buzzwords and pipe dreams.",1562798160.0,2019-07-11 18:04:36.702368,,False,etgsw3s,False,t3_cblpht,t1_etgsh9b,/r/weedstocks/comments/cblpht/rweedstocks_after_hours_discussion_july_10_2019/etgsw3s/,-1,False,weedstocks,t5_2zfqj
throwaway2461357,If you did your DD you'd of known trst was trash before their most recent fins. More than 50% ago.,1562799913.0,2019-07-11 18:04:36.702374,,False,etgvrbv,False,t3_cblpht,t1_etguxqr,/r/weedstocks/comments/cblpht/rweedstocks_after_hours_discussion_july_10_2019/etgvrbv/,0,False,weedstocks,t5_2zfqj
illangai_capital,Canntrust one of the best firms. Best time to buy is now.,1562801128.0,2019-07-11 18:04:36.702379,,False,etgxp1w,False,t3_cblpht,t1_etguxqr,/r/weedstocks/comments/cblpht/rweedstocks_after_hours_discussion_july_10_2019/etgxp1w/,-1,False,weedstocks,t5_2zfqj
TimmyOToolbox,"No he's still on his way.....it'll just take me that long to get anywhere close to having money to pay for it. 

Unless I follow the canntrust way and illegally grow and then sell said illegal weed. 

Then I'll use the chairman's explanation and see how that goes.....

""I think Health Canada has to look at themselves in the mirror and say, ‘Okay, did these guys do it out of desperation or just sheer stupidity,’"" 


Either way it's still ILLEGAL!  


I don't know about you but that statement sounds pretty guilty to me.",1562792214.0,2019-07-11 18:04:36.702390,,False,etgja8e,False,t3_cblpht,t1_etgh1sh,/r/weedstocks/comments/cblpht/rweedstocks_after_hours_discussion_july_10_2019/etgja8e/,1,False,weedstocks,t5_2zfqj
Alupang,explain please,1562805488.0,2019-07-11 18:04:36.702395,,False,eth43lo,False,t3_cblpht,t1_etgt7ap,/r/weedstocks/comments/cblpht/rweedstocks_after_hours_discussion_july_10_2019/eth43lo/,1,False,weedstocks,t5_2zfqj
0therSyde,"Yeah, unlike a lot of the pump & dumps on here, this one really seemed solid and genuine. In fact, they _were_ solid and genuine until they done fucked up bad. They wrecked themselves and took shareholders down with them.",1562809164.0,2019-07-11 18:04:36.702407,,False,eth93jt,False,t3_cblpht,t1_eth8vd0,/r/weedstocks/comments/cblpht/rweedstocks_after_hours_discussion_july_10_2019/eth93jt/,4,False,weedstocks,t5_2zfqj
dmillibeats,Ooooo,1562792925.0,2019-07-11 18:04:36.702414,,False,etgkeq1,False,t3_cblpht,t1_etgjr4o,/r/weedstocks/comments/cblpht/rweedstocks_after_hours_discussion_july_10_2019/etgkeq1/,1,False,weedstocks,t5_2zfqj
0therSyde,"> stall time

Was this on purpose..? LOL",1562808721.0,2019-07-11 18:04:36.702420,,False,eth8i0a,False,t3_cblpht,t1_eth6aom,/r/weedstocks/comments/cblpht/rweedstocks_after_hours_discussion_july_10_2019/eth8i0a/,4,False,weedstocks,t5_2zfqj
JustTellMeTheFacts,"It's been at 26k for the past year, no real movement",1562808674.0,2019-07-11 18:04:36.702424,,False,eth8fr1,False,t3_cblpht,t1_eth6aom,/r/weedstocks/comments/cblpht/rweedstocks_after_hours_discussion_july_10_2019/eth8fr1/,2,False,weedstocks,t5_2zfqj
CrashKeyss,"I heard some Vanguard ETFs still did pretty decent, but in general the markets have been trash in 2019 all around coming off of a HORRENDOUS november/december 2018

What frustrates me isn't the loss. It's knowing I could have held cash for an entire year and gotten in 20-30% lower. I thought for sure the sector would have taken off hard. A lot of us now held long with high hopes and will be making a lot less in the time people who buy in now will be making massive profits

This was a sector where if you're not trading peaks and valleys you're not making money. Investors got shit kicked.",1562804405.0,2019-07-11 18:04:36.702429,,False,eth2m1b,False,t3_cblpht,t1_eth2ijs,/r/weedstocks/comments/cblpht/rweedstocks_after_hours_discussion_july_10_2019/eth2m1b/,5,False,weedstocks,t5_2zfqj
LakeDrinker,"I mean, I like blue chips and hmus a bit better, but it's your call. I've changed it to HMUS A TUNE. If you want something else, let me know!",1562803448.0,2019-07-11 18:04:36.702435,moderator,False,eth19py,False,t3_cblpht,t1_eth0t5b,/r/weedstocks/comments/cblpht/rweedstocks_after_hours_discussion_july_10_2019/eth19py/,3,False,weedstocks,t5_2zfqj
stealthnuck1,The risk factors section is 26 pages long. They list everything 😛,1562790092.0,2019-07-11 18:04:36.702445,,False,etgfw71,False,t3_cblpht,t1_etgfjcy,/r/weedstocks/comments/cblpht/rweedstocks_after_hours_discussion_july_10_2019/etgfw71/,6,False,weedstocks,t5_2zfqj
Navjjj,You aren't understanding the point of the regulations. Now we find out CTST was hiding it purposely.,1562806024.0,2019-07-11 18:04:36.702451,,False,eth4ttf,False,t3_cblpht,t1_etgrdwt,/r/weedstocks/comments/cblpht/rweedstocks_after_hours_discussion_july_10_2019/eth4ttf/,1,False,weedstocks,t5_2zfqj
Mossed84,"I'm glad we're not lower, but I'm not happy with how low it currently is lol",1562803111.0,2019-07-11 18:04:36.702456,,False,eth0saf,False,t3_cblpht,t1_etgttmy,/r/weedstocks/comments/cblpht/rweedstocks_after_hours_discussion_july_10_2019/eth0saf/,3,False,weedstocks,t5_2zfqj
Coco7900,"Oh, look who's back. Got a little lazy coming up with a new alternate username I see. How are your massive bags treating you?",1562794771.0,2019-07-11 18:04:36.702461,,False,etgn9y3,False,t3_cblpht,t1_etgn0v0,/r/weedstocks/comments/cblpht/rweedstocks_after_hours_discussion_july_10_2019/etgn9y3/,2,False,weedstocks,t5_2zfqj
pwd9398,"OP is talking about his hypothetical (but very possible) scenario for Tranche 2 and 3, not Tranche 1. 

In his scenario for Tranche 2 (or 3), that tranche would result in about twice as much dilution (new paper) on the dollar raised.

I didn't think he was particularly ambigious about that.",1562801953.0,2019-07-11 18:04:36.702466,,1562802259.0,etgz06w,False,t3_cblpht,t1_etgn0v0,/r/weedstocks/comments/cblpht/rweedstocks_after_hours_discussion_july_10_2019/etgz06w/,1,False,weedstocks,t5_2zfqj
CrashKeyss,"HC cannot afford to make themselves look weak in their first real issue. For the longevity of the sector they have to set a precedent to not let this happen again. They wouldn't be the first company to lose their license. This was a big fuckup. Not only did they grow it illegally, but they illegally crossed borders with it.",1562804282.0,2019-07-11 18:04:36.702476,,False,eth2fv0,False,t3_cblpht,t1_etgsrtk,/r/weedstocks/comments/cblpht/rweedstocks_after_hours_discussion_july_10_2019/eth2fv0/,5,False,weedstocks,t5_2zfqj
Mindfullmatter,I agree!  There will be tons of FUD on here due to people who panic sold.  This is exactly like the short attack as far as this sub is concerned.,1562801059.0,2019-07-11 18:04:36.702482,,False,etgxl4x,False,t3_cblpht,t1_etgsrtk,/r/weedstocks/comments/cblpht/rweedstocks_after_hours_discussion_july_10_2019/etgxl4x/,3,False,weedstocks,t5_2zfqj
throwaway2461357,"Litigation. If they took capital in good faith their backers are going to sue them. It's not Just the gov. They took cash and knowingly broke the law.

Fines?  Thats nothing. There wont be a company left for gov to slap on the wrist. Their  licence gets revoked and they can't sell weed anymore legally. It didn't stop them before but there's a little more heat this time around.

In a speculative high risk market, are you really willing to bet on the ""best possible outcome""? I'd be thinking worst case scenario right now. There's a reason why they ate shit after fins. They couldn't give weed away.

Breaking the law and still can't sell. Lol",1562798637.0,2019-07-11 18:04:36.702486,,False,etgtoja,False,t3_cblpht,t1_etgsrtk,/r/weedstocks/comments/cblpht/rweedstocks_after_hours_discussion_july_10_2019/etgtoja/,-1,False,weedstocks,t5_2zfqj
throwaway2461357,They couldn't make money when they had product on the shelves lol. Worst margins in the business and zero vision.,1562799661.0,2019-07-11 18:04:36.702491,,False,etgvcjm,False,t3_cblpht,t1_etgsrtk,/r/weedstocks/comments/cblpht/rweedstocks_after_hours_discussion_july_10_2019/etgvcjm/,-2,False,weedstocks,t5_2zfqj
infobox2018,"Man, I can't believe it from a company like TRST, makes it scary for my other holdings. All management heads should roll for this",1562797184.0,2019-07-11 18:04:36.702496,,False,etgra9a,False,t3_cblpht,t1_etgqzy2,/r/weedstocks/comments/cblpht/rweedstocks_after_hours_discussion_july_10_2019/etgra9a/,4,False,weedstocks,t5_2zfqj
Follie_Foliage,Apha's doing better than most other bigs lately in terms of stability.,1562800400.0,2019-07-11 18:04:36.702501,,False,etgwjkx,False,t3_cblpht,t1_etgshp3,/r/weedstocks/comments/cblpht/rweedstocks_after_hours_discussion_july_10_2019/etgwjkx/,3,False,weedstocks,t5_2zfqj
Modal_Window,I don't want them to lose the license if HC was coming to inspect the facility on a monthly basis. I have quite a lot of shares in the $13 range and I am not prepared to call it a day on them.,1562789875.0,2019-07-11 18:04:36.702505,,False,etgfj9o,False,t3_cblpht,t1_etgf9bt,/r/weedstocks/comments/cblpht/rweedstocks_after_hours_discussion_july_10_2019/etgfj9o/,3,False,weedstocks,t5_2zfqj
bobbybadfinger,"I can find mutual ground on most, except,

I think HC has already lost credibility internationally over this. Nothing but a robust system change with checks and balances will serve favour at this point.",1562790438.0,2019-07-11 18:04:36.702520,,False,etggg9a,False,t3_cblpht,t1_etgf9bt,/r/weedstocks/comments/cblpht/rweedstocks_after_hours_discussion_july_10_2019/etggg9a/,1,False,weedstocks,t5_2zfqj
dividedthoughts,"Agreed. People compare it to OGI years ago, but it's different now with so many LPs, especially since many are awaiting license or expansion approval.",1562795866.0,2019-07-11 18:04:36.702524,,False,etgp3xa,False,t3_cblpht,t1_etgnf5i,/r/weedstocks/comments/cblpht/rweedstocks_after_hours_discussion_july_10_2019/etgp3xa/,1,False,weedstocks,t5_2zfqj
Raptorswon,I'm making a video for TRST this week. This one will hurt given what's transpired.,1562790761.0,2019-07-11 18:04:36.702530,,False,etggyrp,False,t3_cblpht,t1_etgg6yz,/r/weedstocks/comments/cblpht/rweedstocks_after_hours_discussion_july_10_2019/etggyrp/,10,False,weedstocks,t5_2zfqj
Skivsamlaren,Making raptor noises is a vital part of my investment strategy.,1562791203.0,2019-07-11 18:04:36.702535,,False,etgho48,False,t3_cblpht,t1_etgg6yz,/r/weedstocks/comments/cblpht/rweedstocks_after_hours_discussion_july_10_2019/etgho48/,5,False,weedstocks,t5_2zfqj
_matrom,still holding IAN?,1562799988.0,2019-07-11 18:04:36.702540,,False,etgvvm4,False,t3_cblpht,t1_etgom2l,/r/weedstocks/comments/cblpht/rweedstocks_after_hours_discussion_july_10_2019/etgvvm4/,2,False,weedstocks,t5_2zfqj
Doughja,"Not that this is new or revelatory but...
>Pro forma revenues: refers to full three months ended March 31, 2019 results, as if the acquisition or management contract commenced as of the beginning of the period regardless of the acquisition or management contract date. This also includes Managed Revenues, which are sales of cannabis products from entities for which management arrangements are in place **but iAnthus cannot consolidate due to regulatory restrictions**, or from equity investments in which results cannot be consolidated. Managed entities include iAnthus' involvement in certain Arizona operations, Colorado, and New Mexico.",1562792374.0,2019-07-11 18:04:36.702545,,False,etgjjkc,False,t3_cblpht,t1_etgigng,/r/weedstocks/comments/cblpht/rweedstocks_after_hours_discussion_july_10_2019/etgjjkc/,-2,False,weedstocks,t5_2zfqj
wrinkledpenny,"Healing Fields 5 is coming in August. I’ve had it before. Nice, easy going sativa. Coolest smelling weed ever! It’s so interesting. And I can’t wait to try this Muskmelon OG!",1562804084.0,2019-07-11 18:04:36.702550,,False,eth25yx,False,t3_cblpht,t1_etgz8tv,/r/weedstocks/comments/cblpht/rweedstocks_after_hours_discussion_july_10_2019/eth25yx/,2,False,weedstocks,t5_2zfqj
MK45124512,"Interesting points, thanks!",1562797941.0,2019-07-11 18:04:36.702561,,False,etgsj89,False,t3_cblpht,t1_etgncsb,/r/weedstocks/comments/cblpht/rweedstocks_after_hours_discussion_july_10_2019/etgsj89/,1,False,weedstocks,t5_2zfqj
Johnkurfismusic,Is that a good thing or a bad thing for the stock price??,1562800577.0,2019-07-11 18:04:36.702567,,False,etgwtho,False,t3_cblpht,t1_etgmixv,/r/weedstocks/comments/cblpht/rweedstocks_after_hours_discussion_july_10_2019/etgwtho/,1,False,weedstocks,t5_2zfqj
CrashKeyss,"This doesn't always work, and when it does it takes at least 6+ months to rebuild a brand once old management is gone, usually longer. I've seen it happen plenty of times, although never in this sector",1562804131.0,2019-07-11 18:04:36.702572,,False,eth28bl,False,t3_cblpht,t1_etgwfg8,/r/weedstocks/comments/cblpht/rweedstocks_after_hours_discussion_july_10_2019/eth28bl/,1,False,weedstocks,t5_2zfqj
0therSyde,"You should not have strayed from the light. Bad things wander unchecked out there in the feral darkness.

Not that I can really chastise anyone, they fucked my butthole pretty good too :(",1562812064.0,2019-07-11 18:04:36.702577,,False,ethcx66,False,t3_cblpht,t1_ethals1,/r/weedstocks/comments/cblpht/rweedstocks_after_hours_discussion_july_10_2019/ethcx66/,0,False,weedstocks,t5_2zfqj
CrashKeyss,"In a situation like this they're not too great to sell at any point because if they lose their license you're going to be down 99% forever. Look at ASNT

Depends on if you're an investor or trader. As a trader, I'd think anytime you're down 10-20% you should sell out if you think it'll get worse, don't risk it any further than that. If you're a good trader it shouldn't ever get to that point though, but that trading level is above most of our expertise. As an investor you have a little more leeway, but this situation is pretty telling. The only positive news you can really get is that they're not COMPLETELY fucked, is that really positive news?

You just said ""obviously that's about to get way worse"" - why would you still hold if you assume that? Shit, if you're long on TRST for whatever reason you should exit out now and rebuy lower unless you're worried about long term vs short term gains tax. In the short term you're not going to see a net gain, but if you think you will in the long term my advice would be to selloff and rebuy lower and forget about the taxing of it. The 10% you might save with long term tax might be offset by you rebuying 10%+ lower, you know? Nobody knows where the bottom is or if it can recover - if we did we'd all be rich

Ask yourself this. Can bagholders deal with a third day of -10% and no positive news? Do the amount of people who want to play TRST thinking it will fully recover offset the people who want out? To me, they don't, and that's why I bailed and won't get back in. The company has a stink on it now far worse than any of the major players in the sector ever had (APHA) and while they can recover from it, they could also lose it all. It's a risk to play it or to hold it IMO.

60% loss sucks, but it's better than further loss. The 40% I had left is in cash being held for a good opportunity to invest that elsewhere and chip away at making that 60% back. If you believe in the company and their ability to rebuild from this then average down after you see some upwards movement. It won't go down forever if they don't lose their license, but it also won't go back up 60%+ by the end of the year with this scandal

Now if you're down 90%+? Then I guess you kind of have to hold because the cash you will generate is probably not much vs the chance it recovers some",1562813195.0,2019-07-11 18:04:36.702582,,1562813450.0,etheea3,False,t3_cblpht,t1_ethcwsi,/r/weedstocks/comments/cblpht/rweedstocks_after_hours_discussion_july_10_2019/etheea3/,4,False,weedstocks,t5_2zfqj
CrashKeyss,"You need to stop talking out of your ass, bud",1562820225.0,2019-07-11 18:04:36.702587,,False,ethmqfa,False,t3_cblpht,t1_ethmh4a,/r/weedstocks/comments/cblpht/rweedstocks_after_hours_discussion_july_10_2019/ethmqfa/,-3,False,weedstocks,t5_2zfqj
toronto905,Right? First I’m hearing of that,1562791282.0,2019-07-11 18:04:36.702593,,False,etghsq1,False,t3_cblpht,t1_etgfe85,/r/weedstocks/comments/cblpht/rweedstocks_after_hours_discussion_july_10_2019/etghsq1/,6,False,weedstocks,t5_2zfqj
CrashKeyss,I bought in at about 47 USD,1562799319.0,2019-07-11 18:04:36.702603,,False,etguscv,False,t3_cblpht,t1_etgm39w,/r/weedstocks/comments/cblpht/rweedstocks_after_hours_discussion_july_10_2019/etguscv/,0,False,weedstocks,t5_2zfqj
deleterious_rabbit,Im seeing AH going @ like 3.07usd. This profit taking or am i missing something here?,1562802108.0,2019-07-11 18:04:36.702609,,False,etgz8x7,False,t3_cblpht,t1_etgsj93,/r/weedstocks/comments/cblpht/rweedstocks_after_hours_discussion_july_10_2019/etgz8x7/,1,False,weedstocks,t5_2zfqj
JohnnnyOnTheSpot,"TFSAs are a great thing .. if you don't lose money. 

&#x200B;

I have done all my investing in mine and luckily wasn't holding any TRST (I've traded it a bunch of times) but it sucks to have to eat those losses AND no recouping that contribution room.",1562821929.0,2019-07-11 18:04:36.702614,,False,ethoifn,False,t3_cblpht,t1_ethm9lv,/r/weedstocks/comments/cblpht/rweedstocks_after_hours_discussion_july_10_2019/ethoifn/,0,False,weedstocks,t5_2zfqj
nightreign,Ya besides the horrible Q no buddy could have expected this.,1562789860.0,2019-07-11 18:04:36.702619,,False,etgfifz,False,t3_cblpht,t1_etgf57v,/r/weedstocks/comments/cblpht/rweedstocks_after_hours_discussion_july_10_2019/etgfifz/,5,False,weedstocks,t5_2zfqj
tykc303,"Maybe his desk is wobbly, and is waiting for it to stop so he can buy",1562790771.0,2019-07-11 18:04:36.702624,,False,etggzda,False,t3_cblpht,t1_etgfksg,/r/weedstocks/comments/cblpht/rweedstocks_after_hours_discussion_july_10_2019/etggzda/,2,False,weedstocks,t5_2zfqj
pwd9398,"They just caught one of top-6 LPs growing and selling illegal weed, 9 months into the start of the regulated and legal recreational weed era.

They absolutely have to make an example of TRST otherwise they may as we put out a news release saying the Canadian cannabis industry is now the wild west",1562801475.0,2019-07-11 18:04:36.702629,,False,etgy8m1,False,t3_cblpht,t1_etgog3z,/r/weedstocks/comments/cblpht/rweedstocks_after_hours_discussion_july_10_2019/etgy8m1/,5,False,weedstocks,t5_2zfqj
,[deleted],1562795685.0,2019-07-11 18:04:36.702635,,False,etgosw1,False,t3_cblpht,t1_etgog3z,/r/weedstocks/comments/cblpht/rweedstocks_after_hours_discussion_july_10_2019/etgosw1/,2,False,weedstocks,t5_2zfqj
throwaway2461357,"Dude. You've never seen this before. This is one of the big guns breaking the law. Operating illegally. Trying to fuck the government? Big daddy? You don't fuck big daddy. Big daddy fucks you.

Play it for a bounce. Sure.

You'll likely make way more opening a short at every high of day. 25,50,80% not unreasonable. Long? Enjoy 5% 

They're already down 50+% from fins. They can keep losing 50% every month and I wouldn't be surprised. TRST holders are beyond done.",1562797841.0,2019-07-11 18:04:36.702666,,False,etgsdds,False,t3_cblpht,t1_etgo6bg,/r/weedstocks/comments/cblpht/rweedstocks_after_hours_discussion_july_10_2019/etgsdds/,-3,False,weedstocks,t5_2zfqj
Modal_Window,I've only ever bought 1 label from Canopy but I liked it enough that I bought it again. Palm Tree CBD. I don't buy it based on appearance but rather the feel. I read some good things about their new offering Boaty McBoatface so I'd like to try that one as well.,1562801603.0,2019-07-11 18:04:36.702672,,False,etgyfoq,False,t3_cblpht,t1_etgx3lc,/r/weedstocks/comments/cblpht/rweedstocks_after_hours_discussion_july_10_2019/etgyfoq/,4,False,weedstocks,t5_2zfqj
shutyerfuckinface,How is that Drake's fault? Kawhi was never going to stay anyway. Toronto winters suck balls.,1562819850.0,2019-07-11 18:04:36.721392,,False,ethmbn9,False,t3_cblpht,t1_ethkd50,/r/weedstocks/comments/cblpht/rweedstocks_after_hours_discussion_july_10_2019/ethmbn9/,2,False,weedstocks,t5_2zfqj
daccord_cava,eh? on `GTII`?,1562791350.0,2019-07-11 18:04:36.721409,,False,etghwpc,False,t3_cblpht,t1_etghtn1,/r/weedstocks/comments/cblpht/rweedstocks_after_hours_discussion_july_10_2019/etghwpc/,1,False,weedstocks,t5_2zfqj
_matrom,good thing GTI doesn't sell cannabis in Canada....what are you on about?,1562792320.0,2019-07-11 18:04:36.721415,,False,etgjgfs,False,t3_cblpht,t1_etghtn1,/r/weedstocks/comments/cblpht/rweedstocks_after_hours_discussion_july_10_2019/etgjgfs/,1,False,weedstocks,t5_2zfqj
MK45124512,Hmm not seeing that on Harv?,1562791372.0,2019-07-11 18:04:36.721422,,False,etghxw4,False,t3_cblpht,t1_etghqj5,/r/weedstocks/comments/cblpht/rweedstocks_after_hours_discussion_july_10_2019/etghxw4/,1,False,weedstocks,t5_2zfqj
actonesceneone,"I think that may have been an assumption my man. I’m with ya though, it fits the bill, but it was never moved on therefore not officially documented as an illegal activity",1562797170.0,2019-07-11 18:04:36.721455,,False,etgr9dp,False,t3_cblpht,t1_etgplgx,/r/weedstocks/comments/cblpht/rweedstocks_after_hours_discussion_july_10_2019/etgr9dp/,1,False,weedstocks,t5_2zfqj
BHOmber,I remember Canopy destroying plants because of mold or something. It's not like they grow anything worth smoking at this point anyways lol,1562798498.0,2019-07-11 18:04:36.721461,,False,etgtgd2,False,t3_cblpht,t1_etgplgx,/r/weedstocks/comments/cblpht/rweedstocks_after_hours_discussion_july_10_2019/etgtgd2/,1,False,weedstocks,t5_2zfqj
jaffnaguy2014,Canopy released a BC shipment video featuring snoop dogg last year. Then it got destroyed due to license delays,1562800666.0,2019-07-11 18:04:36.721467,,False,etgwysy,False,t3_cblpht,t1_etgplgx,/r/weedstocks/comments/cblpht/rweedstocks_after_hours_discussion_july_10_2019/etgwysy/,1,False,weedstocks,t5_2zfqj
CrashKeyss,Alt account confirmed,1562804598.0,2019-07-11 18:04:36.721472,,False,eth2vp2,False,t3_cblpht,t1_eth04l1,/r/weedstocks/comments/cblpht/rweedstocks_after_hours_discussion_july_10_2019/eth2vp2/,3,False,weedstocks,t5_2zfqj
Agent248,"Congrats BAMMERS is what I remember you use to post. 

How is that going?",1562805342.0,2019-07-11 18:04:36.721477,,False,eth3wii,False,t3_cblpht,t1_eth1gvk,/r/weedstocks/comments/cblpht/rweedstocks_after_hours_discussion_july_10_2019/eth3wii/,2,False,weedstocks,t5_2zfqj
Alunidaje,yes. I just checked.,1562858251.0,2019-07-11 18:04:36.721484,,False,etirly1,False,t3_cblpht,t1_eth8vpj,/r/weedstocks/comments/cblpht/rweedstocks_after_hours_discussion_july_10_2019/etirly1/,1,False,weedstocks,t5_2zfqj
skyplt29,"My apologies.  

I consider this the most serious situation yet for this sector.  I have no idea how this is going to play out.  I am disappointed in their CEO.  This guy came from Tangerine Bank and had a solid reputation.  Unless he actually never visited the facility how could he not know what was going on.  I am not after blood, but am afraid after all the other stuff that has been happening HC is going to have to make an example.",1562801200.0,2019-07-11 18:04:36.721495,,1562801458.0,etgxt7y,False,t3_cblpht,t1_etgxck1,/r/weedstocks/comments/cblpht/rweedstocks_after_hours_discussion_july_10_2019/etgxt7y/,3,False,weedstocks,t5_2zfqj
throwaway2461357,"Nothing's changed. They were a company without a plan or a vision before all of this. Their price per gram was lower than the other LPs and their costs were much higher. Their margins were garbage and They had no plan. This is just accelerating the eventual pitfall. 

Like a bandaid. Rip it off. Honestly better for holders in the long run, you won't waste your time hoping for  a trend change. It should be painfully obvious that's not going to happen.",1562800118.0,2019-07-11 18:04:36.721502,,False,etgw37y,False,t3_cblpht,t1_etgsz6s,/r/weedstocks/comments/cblpht/rweedstocks_after_hours_discussion_july_10_2019/etgw37y/,2,False,weedstocks,t5_2zfqj
hobnob577,"No chance they pay a fine. Imagine the precedent that sets. 

“Feel free to grow as much weed, wherever you want? If we catch you, slap on the wrist and a cheeky little fine, which probably is significantly less than what you made off that illegal weed. Anyhow, continue on!”",1562798573.0,2019-07-11 18:04:36.721508,,False,etgtkqn,False,t3_cblpht,t1_etgsz6s,/r/weedstocks/comments/cblpht/rweedstocks_after_hours_discussion_july_10_2019/etgtkqn/,0,False,weedstocks,t5_2zfqj
